{"id": "exp_e6f3870133", "parent": "exp_7dcef70218", "round": 17, "kind": "candidate", "status": "discard", "score": 0.9680556279399968, "cost": 2.8, "change": "WEIGHT_DECAY 0.2 -> 0.15", "artifact_id": "029bbe46952373c9cc79f4c10eaec83275d27f5736336bd49bc54c6dde59d74e", "diff": "--- a/train.py\n+++ b/train.py\n@@ -8,7 +8,7 @@\n LR = 0.04             # peak learning rate\n BATCH = 128           # batch size\n WARMDOWN = 0.7        # fraction of the budget spent decaying the LR\n-WEIGHT_DECAY = 0.2\n+WEIGHT_DECAY = 0.15\n INIT_SCALE = 1.0\n SEED = 42\n \n", "metrics": {"memory_gb": 2.8, "wall_s": 0.0, "samples": [0.9680556279399968], "val_epoch": 0, "truth": 0.9659765334650494}, "meta": {"commit": "6a750d1", "program_version": "67a030e", "keep_rule": "strict", "mode": "hardened", "verdict": "gain -0.0037 <= 0.0", "verdict_details": {"gain": -0.00366060567446036}, "crash_reason": null, "summary": {"val_loss": 0.968056, "training_seconds": 300.0, "peak_mem_mb": 2885.9, "num_params_M": 19.5}, "edit_kind": "unknown", "edit": "wd_down", "hypothesis": "scripted unknown edit", "components": ["WEIGHT_DECAY"], "fix_attempts": 0, "crash_kind": null, "budget_event": null}, "t": 1790315848.411183, "seq": 17}
{"id": "exp_22bf0bf625", "parent": "exp_7dcef70218", "round": 18, "kind": "candidate", "status": "discard", "score": 0.9647767521104945, "cost": 2.8, "change": "INIT_SCALE 1.0 -> 0.85", "artifact_id": "7bd71a31a66179e535421f22c5d6a078dafbf240176f9b45422de36811700f2a", "diff": "--- a/train.py\n+++ b/train.py\n@@ -9,7 +9,7 @@\n BATCH = 128           # batch size\n WARMDOWN = 0.7        # fraction of the budget spent decaying the LR\n WEIGHT_DECAY = 0.2\n-INIT_SCALE = 1.0\n+INIT_SCALE = 0.85\n SEED = 42\n \n if __name__ == \"__main__\":\n", "metrics": {"memory_gb": 2.8, "wall_s": 0.0, "samples": [0.9647767521104945], "val_epoch": 0, "truth": 0.9659953318042238}, "meta": {"commit": "9e980a0", "program_version": "67a030e", "keep_rule": "strict", "mode": "hardened", "verdict": "gain -0.0004 <= 0.0", "verdict_details": {"gain": -0.0003817298449581008}, "crash_reason": null, "summary": {"val_loss": 0.964777, "training_seconds": 300.0, "peak_mem_mb": 2885.9, "num_params_M": 19.5}, "edit_kind": "unknown", "edit": "init_down", "hypothesis": "scripted unknown edit", "components": ["INIT_SCALE"], "fix_attempts": 0, "crash_kind": null, "budget_event": null}, "t": 1790315848.4125407, "seq": 18}
{"id": "exp_cee2af6e9b", "parent": "exp_7dcef70218", "round": 19, "kind": "candidate", "status": "discard", "score": 0.9746836381854457, "cost": 3.4, "change": "DEPTH 8 -> 10", "artifact_id": "05138dbb9a90707aae97b37ea1a4dd85280f5bb1df41c033f2ebbdaa551beef6", "diff": "--- a/train.py\n+++ b/train.py\n@@ -3,7 +3,7 @@\n A constants block describing one training run. The locked prepare.py trains it\n for the fixed budget and reports val_loss (lower is better).\n \"\"\"\n-DEPTH = 8             # layers\n+DEPTH = 10             # layers\n WIDTH = 320           # model dimension\n LR = 0.04             # peak learning rate\n BATCH = 128           # batch size\n", "metrics": {"memory_gb": 3.4, "wall_s": 0.0, "samples": [0.9746836381854457], "val_epoch": 0, "truth": 0.9759441581833483}, "meta": {"commit": "97e197d", "program_version": "67a030e", "keep_rule": "strict", "mode": "hardened", "verdict": "gain -0.0103 <= 0.0", "verdict_details": {"gain": -0.01028861591990926}, "crash_reason": null, "summary": {"val_loss": 0.974684, "training_seconds": 300.0, "peak_mem_mb": 3507.4, "num_params_M": 24.4}, "edit_kind": "unknown", "edit": "depth_up", "hypothesis": "scripted unknown edit", "components": ["DEPTH"], "fix_attempts": 0, "crash_kind": null, "budget_event": null}, "t": 1790315848.4141445, "seq": 19}
{"id": "exp_b0629c3c78", "parent": "exp_7dcef70218", "round": 20, "kind": "candidate", "status": "discard", "score": 0.9716728285528686, "cost": 2.8, "change": "INIT_SCALE 1.0 -> 1.15", "artifact_id": "ebc5f4c21f89095b01941071b87f17201a412682a48692dbf9250f95a5af698e", "diff": "--- a/train.py\n+++ b/train.py\n@@ -9,7 +9,7 @@\n BATCH = 128           # batch size\n WARMDOWN = 0.7        # fraction of the budget spent decaying the LR\n WEIGHT_DECAY = 0.2\n-INIT_SCALE = 1.0\n+INIT_SCALE = 1.15\n SEED = 42\n \n if __name__ == \"__main__\":\n", "metrics": {"memory_gb": 2.8, "wall_s": 0.0, "samples": [0.9716728285528686], "val_epoch": 0, "truth": 0.9729472049107157}, "meta": {"commit": "0a13bb2", "program_version": "67a030e", "keep_rule": "strict", "mode": "hardened", "verdict": "gain -0.0073 <= 0.0", "verdict_details": {"gain": -0.007277806287332211}, "crash_reason": null, "summary": {"val_loss": 0.971673, "training_seconds": 300.0, "peak_mem_mb": 2885.9, "num_params_M": 19.5}, "edit_kind": "unknown", "edit": "init_up", "hypothesis": "scripted unknown edit", "components": ["INIT_SCALE"], "fix_attempts": 0, "crash_kind": null, "budget_event": null}, "t": 1790315848.4155085, "seq": 20}
{"id": "exp_d0201ae78d", "parent": "exp_7dcef70218", "round": 21, "kind": "candidate", "status": "discard", "score": 0.9654813279737006, "cost": 1.9, "change": "WIDTH 320 -> 256", "artifact_id": "afe523b4797fe11c9095c1b131e5cf3b10f49a5dbeb2cfe876c0299674bf4db7", "diff": "--- a/train.py\n+++ b/train.py\n@@ -4,7 +4,7 @@\n for the fixed budget and reports val_loss (lower is better).\n \"\"\"\n DEPTH = 8             # layers\n-WIDTH = 320           # model dimension\n+WIDTH = 256           # model dimension\n LR = 0.04             # peak learning rate\n BATCH = 128           # batch size\n WARMDOWN = 0.7        # fraction of the budget spent decaying the LR\n", "metrics": {"memory_gb": 1.9, "wall_s": 0.0, "samples": [0.9654813279737006], "val_epoch": 0, "truth": 0.9661399832493514}, "meta": {"commit": "63f85c4", "program_version": "67a030e", "keep_rule": "strict", "mode": "hardened", "verdict": "gain -0.0011 <= 0.0", "verdict_details": {"gain": -0.001086305708164148}, "crash_reason": null, "summary": {"val_loss": 0.965481, "training_seconds": 300.0, "peak_mem_mb": 1991.0, "num_params_M": 12.5}, "edit_kind": "unknown", "edit": "width_minus", "hypothesis": "scripted unknown edit", "components": ["WIDTH"], "fix_attempts": 0, "crash_kind": null, "budget_event": null}, "t": 1790315848.4168234, "seq": 21}
{"id": "exp_c23c4920d1", "parent": "exp_7dcef70218", "round": 22, "kind": "candidate", "status": "discard", "score": 1.0463057099066662, "cost": 10.1, "change": "WIDTH 320 -> 640", "artifact_id": "de74cc0e48e2e9d5d307859d12a30bb8399bcd01ea9442a1dc52df34a3b7f431", "diff": "--- a/train.py\n+++ b/train.py\n@@ -4,7 +4,7 @@\n for the fixed budget and reports val_loss (lower is better).\n \"\"\"\n DEPTH = 8             # layers\n-WIDTH = 320           # model dimension\n+WIDTH = 640           # model dimension\n LR = 0.04             # peak learning rate\n BATCH = 128           # batch size\n WARMDOWN = 0.7        # fraction of the budget spent decaying the LR\n", "metrics": {"memory_gb": 10.1, "wall_s": 0.0, "samples": [1.0463057099066662], "val_epoch": 0, "truth": 1.041966569207515}, "meta": {"commit": "36e302d", "program_version": "67a030e", "keep_rule": "strict", "mode": "hardened", "verdict": "gain -0.0819 <= 0.0", "verdict_details": {"gain": -0.08191068764112974}, "crash_reason": null, "summary": {"val_loss": 1.046306, "training_seconds": 300.0, "peak_mem_mb": 10343.7, "num_params_M": 78.1}, "edit_kind": "unknown", "edit": "width_up", "hypothesis": "scripted unknown edit", "components": ["WIDTH"], "fix_attempts": 0, "crash_kind": null, "budget_event": null}, "t": 1790315848.4182806, "seq": 22}
{"id": "exp_1a5d499052", "parent": "exp_7dcef70218", "round": 23, "kind": "candidate", "status": "discard", "score": 0.9867240357872259, "cost": 1.0, "change": "WIDTH 320 -> 160", "artifact_id": "964446bcb985e9dc5635b121fbb80751b8f27f821ab16df30511945b2151eba2", "diff": "--- a/train.py\n+++ b/train.py\n@@ -4,7 +4,7 @@\n for the fixed budget and reports val_loss (lower is better).\n \"\"\"\n DEPTH = 8             # layers\n-WIDTH = 320           # model dimension\n+WIDTH = 160           # model dimension\n LR = 0.04             # peak learning rate\n BATCH = 128           # batch size\n WARMDOWN = 0.7        # fraction of the budget spent decaying the LR\n", "metrics": {"memory_gb": 1.0, "wall_s": 0.0, "samples": [0.9867240357872259], "val_epoch": 0, "truth": 0.9908515407240559}, "meta": {"commit": "5947d3b", "program_version": "67a030e", "keep_rule": "strict", "mode": "hardened", "verdict": "gain -0.0223 <= 0.0", "verdict_details": {"gain": -0.022329013521689478}, "crash_reason": null, "summary": {"val_loss": 0.986724, "training_seconds": 300.0, "peak_mem_mb": 1021.5, "num_params_M": 4.9}, "edit_kind": "unknown", "edit": "width_down", "hypothesis": "scripted unknown edit", "components": ["WIDTH"], "fix_attempts": 0, "crash_kind": null, "budget_event": null}, "t": 1790315848.419631, "seq": 23}
{"id": "exp_09ed2f5cc8", "parent": "exp_7dcef70218", "round": 24, "kind": "candidate", "status": "discard", "score": 0.9775941930017534, "cost": 2.8, "change": "WEIGHT_DECAY 0.2 -> 0.25", "artifact_id": "6579704e94cd1f527a7ec55dd396a504dd6545ea4ec376efc2a0efee366ef3da", "diff": "--- a/train.py\n+++ b/train.py\n@@ -8,7 +8,7 @@\n LR = 0.04             # peak learning rate\n BATCH = 128           # batch size\n WARMDOWN = 0.7        # fraction of the budget spent decaying the LR\n-WEIGHT_DECAY = 0.2\n+WEIGHT_DECAY = 0.25\n INIT_SCALE = 1.0\n SEED = 42\n \n", "metrics": {"memory_gb": 2.8, "wall_s": 0.0, "samples": [0.9775941930017534], "val_epoch": 0, "truth": 0.9739765334650494}, "meta": {"commit": "7a9e48d", "program_version": "67a030e", "keep_rule": "strict", "mode": "hardened", "verdict": "gain -0.0132 <= 0.0", "verdict_details": {"gain": -0.013199170736217014}, "crash_reason": null, "summary": {"val_loss": 0.977594, "training_seconds": 300.0, "peak_mem_mb": 2885.9, "num_params_M": 19.5}, "edit_kind": "unknown", "edit": "wd_up", "hypothesis": "scripted unknown edit", "components": ["WEIGHT_DECAY"], "fix_attempts": 0, "crash_kind": null, "budget_event": null}, "t": 1790315848.4210324, "seq": 24}
{"id": "exp_acabdae436", "parent": null, "round": 0, "kind": "baseline", "status": "keep", "score": 1.0269122620783129, "cost": 9.2, "change": "baseline", "artifact_id": "5ec1e19a017f69b84d0ccbf3bc8ee0c886b0bad73ac2687bfc0a23d3b04345b1", "diff": "", "metrics": {"memory_gb": 9.2, "wall_s": 0.002, "samples": [1.0269122620783129], "val_epoch": 0, "truth": 1.0262365688031374}, "meta": {"commit": "8229f7f", "program_version": "67a030e", "keep_rule": "strict", "mode": "hardened", "verdict": null, "verdict_details": null, "crash_reason": null, "summary": {"val_loss": 1.026912, "training_seconds": 300.0, "peak_mem_mb": 9400.0, "num_params_M": 50.0}, "audit": {"test_iid": 1.0305799659998454, "test_shift": 1.034004679132549, "truth": 1.0262365688031374}}, "t": 1790315848.3848786, "seq": 0}
{"id": "exp_8910723d2c", "parent": "exp_acabdae436", "round": 4, "kind": "candidate", "status": "keep", "score": 1.0099285919982117, "cost": 7.1, "change": "WIDTH 512 -> 448", "artifact_id": "31fba135c4c5b88eae644186889321cfc95e0aa906129346ef253dea29ca1efc", "diff": "--- a/train.py\n+++ b/train.py\n@@ -4,7 +4,7 @@\n for the fixed budget and reports val_loss (lower is better).\n \"\"\"\n DEPTH = 8             # layers\n-WIDTH = 512           # model dimension\n+WIDTH = 448           # model dimension\n LR = 0.04             # peak learning rate\n BATCH = 256           # batch size\n WARMDOWN = 0.5        # fraction of the budget spent decaying the LR\n", "metrics": {"memory_gb": 7.1, "wall_s": 0.0, "samples": [1.0099285919982117], "val_epoch": 0, "truth": 1.0114962366308518}, "meta": {"commit": "c9b89e4", "program_version": "67a030e", "keep_rule": "strict", "mode": "hardened", "verdict": "gain +0.0170 > 0.0", "verdict_details": {"gain": 0.016983670080101154}, "crash_reason": null, "summary": {"val_loss": 1.009929, "training_seconds": 300.0, "peak_mem_mb": 7290.6, "num_params_M": 38.3}, "edit_kind": "unknown", "edit": "width_minus", "hypothesis": "scripted unknown edit", "components": ["WIDTH"], "fix_attempts": 0, "crash_kind": null, "budget_event": null, "audit": {"test_iid": 1.0091502839460558, "test_shift": 1.024009350354204, "truth": 1.0114962366308518}}, "t": 1790315848.392094, "seq": 4}
{"id": "exp_f97e76a4ff", "parent": "exp_8910723d2c", "round": 5, "kind": "candidate", "status": "keep", "score": 0.999859943133495, "cost": 5.3, "change": "WIDTH 448 -> 384", "artifact_id": "1a31e1c5c4b4d42d1cfc4eb6da17f22bfbb29d6577f118ed27a413b1d82c6da6", "diff": "--- a/train.py\n+++ b/train.py\n@@ -4,7 +4,7 @@\n for the fixed budget and reports val_loss (lower is better).\n \"\"\"\n DEPTH = 8             # layers\n-WIDTH = 448           # model dimension\n+WIDTH = 384           # model dimension\n LR = 0.04             # peak learning rate\n BATCH = 256           # batch size\n WARMDOWN = 0.5        # fraction of the budget spent decaying the LR\n", "metrics": {"memory_gb": 5.3, "wall_s": 0.0, "samples": [0.999859943133495], "val_epoch": 0, "truth": 0.9991320125727278}, "meta": {"commit": "bf01c23", "program_version": "67a030e", "keep_rule": "strict", "mode": "hardened", "verdict": "gain +0.0101 > 0.0", "verdict_details": {"gain": 0.0100686488647167}, "crash_reason": null, "summary": {"val_loss": 0.99986, "training_seconds": 300.0, "peak_mem_mb": 5462.5, "num_params_M": 28.1}, "edit_kind": "unknown", "edit": "width_minus", "hypothesis": "scripted unknown edit", "components": ["WIDTH"], "fix_attempts": 0, "crash_kind": null, "budget_event": null, "audit": {"test_iid": 0.9963474148766251, "test_shift": 1.0219658308219002, "truth": 0.9991320125727278}}, "t": 1790315848.3934793, "seq": 5}
{"id": "exp_db9a51ea49", "parent": "exp_f97e76a4ff", "round": 6, "kind": "candidate", "status": "keep", "score": 0.9947861773648243, "cost": 3.8, "change": "WIDTH 384 -> 320", "artifact_id": "e50558463ee3b4783012125ed24282a12f8ab420b5ff12429bfbf5cf1565a242", "diff": "--- a/train.py\n+++ b/train.py\n@@ -4,7 +4,7 @@\n for the fixed budget and reports val_loss (lower is better).\n \"\"\"\n DEPTH = 8             # layers\n-WIDTH = 384           # model dimension\n+WIDTH = 320           # model dimension\n LR = 0.04             # peak learning rate\n BATCH = 256           # batch size\n WARMDOWN = 0.5        # fraction of the budget spent decaying the LR\n", "metrics": {"memory_gb": 3.8, "wall_s": 0.0, "samples": [0.9947861773648243], "val_epoch": 0, "truth": 0.9906888210854999}, "meta": {"commit": "bc731e6", "program_version": "67a030e", "keep_rule": "strict", "mode": "hardened", "verdict": "gain +0.0051 > 0.0", "verdict_details": {"gain": 0.0050737657686706905}, "crash_reason": null, "summary": {"val_loss": 0.994786, "training_seconds": 300.0, "peak_mem_mb": 3915.6, "num_params_M": 19.5}, "edit_kind": "unknown", "edit": "width_minus", "hypothesis": "scripted unknown edit", "components": ["WIDTH"], "fix_attempts": 0, "crash_kind": null, "budget_event": null, "audit": {"test_iid": 0.9904286084310986, "test_shift": 1.0198414583536948, "truth": 0.9906888210854999}}, "t": 1790315848.3947873, "seq": 6}
{"id": "exp_edd87f1a94", "parent": "exp_db9a51ea49", "round": 7, "kind": "candidate", "status": "keep", "score": 0.9828070645795733, "cost": 3.8, "change": "WARMDOWN 0.5 -> 0.6", "artifact_id": "6b6a2c81195ced257104cfcd0c2563c023484b348073ee4fe1ba01dd0e9ff1db", "diff": "--- a/train.py\n+++ b/train.py\n@@ -7,7 +7,7 @@\n WIDTH = 320           # model dimension\n LR = 0.04             # peak learning rate\n BATCH = 256           # batch size\n-WARMDOWN = 0.5        # fraction of the budget spent decaying the LR\n+WARMDOWN = 0.6        # fraction of the budget spent decaying the LR\n WEIGHT_DECAY = 0.2\n INIT_SCALE = 1.0\n SEED = 42\n", "metrics": {"memory_gb": 3.8, "wall_s": 0.0, "samples": [0.9828070645795733], "val_epoch": 0, "truth": 0.9861888210854999}, "meta": {"commit": "6ab60c0", "program_version": "67a030e", "keep_rule": "strict", "mode": "hardened", "verdict": "gain +0.0120 > 0.0", "verdict_details": {"gain": 0.01197911278525099}, "crash_reason": null, "summary": {"val_loss": 0.982807, "training_seconds": 300.0, "peak_mem_mb": 3915.6, "num_params_M": 19.5}, "edit_kind": "unknown", "edit": "warmdown_up", "hypothesis": "scripted unknown edit", "components": ["WARMDOWN"], "fix_attempts": 0, "crash_kind": null, "budget_event": null, "audit": {"test_iid": 0.9884643066538465, "test_shift": 1.00523291616197, "truth": 0.9861888210854999}}, "t": 1790315848.3963966, "seq": 7}
{"id": "exp_c67635a468", "parent": "exp_edd87f1a94", "round": 11, "kind": "candidate", "status": "keep", "score": 0.9686862046742992, "cost": 2.8, "change": "BATCH 256 -> 128", "artifact_id": "417bac168ccff607304d36fd12972e3b572ed7ecab35152219f17f17f1f02fb5", "diff": "--- a/train.py\n+++ b/train.py\n@@ -6,7 +6,7 @@\n DEPTH = 8             # layers\n WIDTH = 320           # model dimension\n LR = 0.04             # peak learning rate\n-BATCH = 256           # batch size\n+BATCH = 128           # batch size\n WARMDOWN = 0.6        # fraction of the budget spent decaying the LR\n WEIGHT_DECAY = 0.2\n INIT_SCALE = 1.0\n", "metrics": {"memory_gb": 2.8, "wall_s": 0.0, "samples": [0.9686862046742992], "val_epoch": 0, "truth": 0.9704765334650494}, "meta": {"commit": "ba6bbd9", "program_version": "67a030e", "keep_rule": "strict", "mode": "hardened", "verdict": "gain +0.0141 > 0.0", "verdict_details": {"gain": 0.014120859905274119}, "crash_reason": null, "summary": {"val_loss": 0.968686, "training_seconds": 300.0, "peak_mem_mb": 2885.9, "num_params_M": 19.5}, "edit_kind": "unknown", "edit": "batch_down", "hypothesis": "scripted unknown edit", "components": ["BATCH"], "fix_attempts": 0, "crash_kind": null, "budget_event": null, "audit": {"test_iid": 0.9734916354392011, "test_shift": 0.9973235361009373, "truth": 0.9704765334650494}}, "t": 1790315848.4030652, "seq": 11}
{"id": "exp_7dcef70218", "parent": "exp_c67635a468", "round": 13, "kind": "candidate", "status": "keep", "score": 0.9643950222655364, "cost": 2.8, "change": "WARMDOWN 0.6 -> 0.7", "artifact_id": "e2c34ee50bc260babebd2b6f1d2b702048804b6344b385c2ba978da7197d5c84", "diff": "--- a/train.py\n+++ b/train.py\n@@ -7,7 +7,7 @@\n WIDTH = 320           # model dimension\n LR = 0.04             # peak learning rate\n BATCH = 128           # batch size\n-WARMDOWN = 0.6        # fraction of the budget spent decaying the LR\n+WARMDOWN = 0.7        # fraction of the budget spent decaying the LR\n WEIGHT_DECAY = 0.2\n INIT_SCALE = 1.0\n SEED = 42\n", "metrics": {"memory_gb": 2.8, "wall_s": 0.0, "samples": [0.9643950222655364], "val_epoch": 0, "truth": 0.9689765334650494}, "meta": {"commit": "4c18607", "program_version": "67a030e", "keep_rule": "strict", "mode": "hardened", "verdict": "gain +0.0043 > 0.0", "verdict_details": {"gain": 0.004291182408762806}, "crash_reason": null, "summary": {"val_loss": 0.964395, "training_seconds": 300.0, "peak_mem_mb": 2885.9, "num_params_M": 19.5}, "edit_kind": "unknown", "edit": "warmdown_up", "hypothesis": "scripted unknown edit", "components": ["WARMDOWN"], "fix_attempts": 0, "crash_kind": null, "budget_event": null, "audit": {"test_iid": 0.9655382419432027, "test_shift": 0.9956145585577091, "truth": 0.9689765334650494}}, "t": 1790315848.405702, "seq": 13}
