{"id": "exp_acabdae436", "parent": null, "round": 0, "kind": "baseline", "status": "keep", "score": 1.0269122620783129, "cost": 9.2, "change": "baseline", "artifact_id": "5ec1e19a017f69b84d0ccbf3bc8ee0c886b0bad73ac2687bfc0a23d3b04345b1", "diff": "", "metrics": {"memory_gb": 9.2, "wall_s": 0.002, "samples": [1.0269122620783129], "val_epoch": 0, "truth": 1.0262365688031374}, "meta": {"commit": "8229f7f", "program_version": "67a030e", "keep_rule": "strict", "mode": "hardened", "verdict": null, "verdict_details": null, "crash_reason": null, "summary": {"val_loss": 1.026912, "training_seconds": 300.0, "peak_mem_mb": 9400.0, "num_params_M": 50.0}}, "t": 1790315848.3848786, "seq": 0}
{"id": "exp_cb06e4ba88", "parent": "exp_acabdae436", "round": 1, "kind": "candidate", "status": "discard", "score": 1.0325963368772022, "cost": 9.2, "change": "WEIGHT_DECAY 0.2 -> 0.25", "artifact_id": "6e1fa9c865200ddab9ced5869bc673525f734f62a4209d7b67ae877e2fe9e1e9", "diff": "--- a/train.py\n+++ b/train.py\n@@ -8,7 +8,7 @@\n LR = 0.04             # peak learning rate\n BATCH = 256           # batch size\n WARMDOWN = 0.5        # fraction of the budget spent decaying the LR\n-WEIGHT_DECAY = 0.2\n+WEIGHT_DECAY = 0.25\n INIT_SCALE = 1.0\n SEED = 42\n \n", "metrics": {"memory_gb": 9.2, "wall_s": 0.0, "samples": [1.0325963368772022], "val_epoch": 0, "truth": 1.0312365688031373}, "meta": {"commit": "c34e5c5", "program_version": "67a030e", "keep_rule": "strict", "mode": "hardened", "verdict": "gain -0.0057 <= 0.0", "verdict_details": {"gain": -0.005684074798889327}, "crash_reason": null, "summary": {"val_loss": 1.032596, "training_seconds": 300.0, "peak_mem_mb": 9400.0, "num_params_M": 50.0}, "edit_kind": "unknown", "edit": "wd_up", "hypothesis": "scripted unknown edit", "components": ["WEIGHT_DECAY"], "fix_attempts": 0, "crash_kind": null, "budget_event": null}, "t": 1790315848.3873134, "seq": 1}
{"id": "exp_3205648843", "parent": "exp_acabdae436", "round": 2, "kind": "candidate", "status": "discard", "score": 1.0458081327691542, "cost": 11.5, "change": "WIDTH 512 -> 576", "artifact_id": "7d5b43451ab3bafdd589574d438791d50cc9846583dbc867b56d297eee0c6a4c", "diff": "--- a/train.py\n+++ b/train.py\n@@ -4,7 +4,7 @@\n for the fixed budget and reports val_loss (lower is better).\n \"\"\"\n DEPTH = 8             # layers\n-WIDTH = 512           # model dimension\n+WIDTH = 576           # model dimension\n LR = 0.04             # peak learning rate\n BATCH = 256           # batch size\n WARMDOWN = 0.5        # fraction of the budget spent decaying the LR\n", "metrics": {"memory_gb": 11.5, "wall_s": 0.0, "samples": [1.0458081327691542], "val_epoch": 0, "truth": 1.042474910756981}, "meta": {"commit": "acb3f4b", "program_version": "67a030e", "keep_rule": "strict", "mode": "hardened", "verdict": "gain -0.0189 <= 0.0", "verdict_details": {"gain": -0.01889587069084131}, "crash_reason": null, "summary": {"val_loss": 1.045808, "training_seconds": 300.0, "peak_mem_mb": 11790.6, "num_params_M": 63.3}, "edit_kind": "unknown", "edit": "width_plus", "hypothesis": "scripted unknown edit", "components": ["WIDTH"], "fix_attempts": 0, "crash_kind": null, "budget_event": null}, "t": 1790315848.3890345, "seq": 2}
{"id": "exp_1ab98768ff", "parent": "exp_acabdae436", "round": 3, "kind": "candidate", "status": "discard", "score": 1.0273517624362836, "cost": 9.2, "change": "LR 0.04 -> 0.0267", "artifact_id": "40890414672314f677394e92be08cb944b507c34eaa1cc6eb0c1eecdada253c6", "diff": "--- a/train.py\n+++ b/train.py\n@@ -5,7 +5,7 @@\n \"\"\"\n DEPTH = 8             # layers\n WIDTH = 512           # model dimension\n-LR = 0.04             # peak learning rate\n+LR = 0.0267             # peak learning rate\n BATCH = 256           # batch size\n WARMDOWN = 0.5        # fraction of the budget spent decaying the LR\n WEIGHT_DECAY = 0.2\n", "metrics": {"memory_gb": 9.2, "wall_s": 0.0, "samples": [1.0273517624362836], "val_epoch": 0, "truth": 1.0289571758960359}, "meta": {"commit": "3b86cda", "program_version": "67a030e", "keep_rule": "strict", "mode": "hardened", "verdict": "gain -0.0004 <= 0.0", "verdict_details": {"gain": -0.0004395003579706902}, "crash_reason": null, "summary": {"val_loss": 1.027352, "training_seconds": 300.0, "peak_mem_mb": 9400.0, "num_params_M": 50.0}, "edit_kind": "unknown", "edit": "lr_down", "hypothesis": "scripted unknown edit", "components": ["LR"], "fix_attempts": 0, "crash_kind": null, "budget_event": null}, "t": 1790315848.3906894, "seq": 3}
{"id": "exp_8910723d2c", "parent": "exp_acabdae436", "round": 4, "kind": "candidate", "status": "keep", "score": 1.0099285919982117, "cost": 7.1, "change": "WIDTH 512 -> 448", "artifact_id": "31fba135c4c5b88eae644186889321cfc95e0aa906129346ef253dea29ca1efc", "diff": "--- a/train.py\n+++ b/train.py\n@@ -4,7 +4,7 @@\n for the fixed budget and reports val_loss (lower is better).\n \"\"\"\n DEPTH = 8             # layers\n-WIDTH = 512           # model dimension\n+WIDTH = 448           # model dimension\n LR = 0.04             # peak learning rate\n BATCH = 256           # batch size\n WARMDOWN = 0.5        # fraction of the budget spent decaying the LR\n", "metrics": {"memory_gb": 7.1, "wall_s": 0.0, "samples": [1.0099285919982117], "val_epoch": 0, "truth": 1.0114962366308518}, "meta": {"commit": "c9b89e4", "program_version": "67a030e", "keep_rule": "strict", "mode": "hardened", "verdict": "gain +0.0170 > 0.0", "verdict_details": {"gain": 0.016983670080101154}, "crash_reason": null, "summary": {"val_loss": 1.009929, "training_seconds": 300.0, "peak_mem_mb": 7290.6, "num_params_M": 38.3}, "edit_kind": "unknown", "edit": "width_minus", "hypothesis": "scripted unknown edit", "components": ["WIDTH"], "fix_attempts": 0, "crash_kind": null, "budget_event": null}, "t": 1790315848.392094, "seq": 4}
{"id": "exp_f97e76a4ff", "parent": "exp_8910723d2c", "round": 5, "kind": "candidate", "status": "keep", "score": 0.999859943133495, "cost": 5.3, "change": "WIDTH 448 -> 384", "artifact_id": "1a31e1c5c4b4d42d1cfc4eb6da17f22bfbb29d6577f118ed27a413b1d82c6da6", "diff": "--- a/train.py\n+++ b/train.py\n@@ -4,7 +4,7 @@\n for the fixed budget and reports val_loss (lower is better).\n \"\"\"\n DEPTH = 8             # layers\n-WIDTH = 448           # model dimension\n+WIDTH = 384           # model dimension\n LR = 0.04             # peak learning rate\n BATCH = 256           # batch size\n WARMDOWN = 0.5        # fraction of the budget spent decaying the LR\n", "metrics": {"memory_gb": 5.3, "wall_s": 0.0, "samples": [0.999859943133495], "val_epoch": 0, "truth": 0.9991320125727278}, "meta": {"commit": "bf01c23", "program_version": "67a030e", "keep_rule": "strict", "mode": "hardened", "verdict": "gain +0.0101 > 0.0", "verdict_details": {"gain": 0.0100686488647167}, "crash_reason": null, "summary": {"val_loss": 0.99986, "training_seconds": 300.0, "peak_mem_mb": 5462.5, "num_params_M": 28.1}, "edit_kind": "unknown", "edit": "width_minus", "hypothesis": "scripted unknown edit", "components": ["WIDTH"], "fix_attempts": 0, "crash_kind": null, "budget_event": null}, "t": 1790315848.3934793, "seq": 5}
{"id": "exp_db9a51ea49", "parent": "exp_f97e76a4ff", "round": 6, "kind": "candidate", "status": "keep", "score": 0.9947861773648243, "cost": 3.8, "change": "WIDTH 384 -> 320", "artifact_id": "e50558463ee3b4783012125ed24282a12f8ab420b5ff12429bfbf5cf1565a242", "diff": "--- a/train.py\n+++ b/train.py\n@@ -4,7 +4,7 @@\n for the fixed budget and reports val_loss (lower is better).\n \"\"\"\n DEPTH = 8             # layers\n-WIDTH = 384           # model dimension\n+WIDTH = 320           # model dimension\n LR = 0.04             # peak learning rate\n BATCH = 256           # batch size\n WARMDOWN = 0.5        # fraction of the budget spent decaying the LR\n", "metrics": {"memory_gb": 3.8, "wall_s": 0.0, "samples": [0.9947861773648243], "val_epoch": 0, "truth": 0.9906888210854999}, "meta": {"commit": "bc731e6", "program_version": "67a030e", "keep_rule": "strict", "mode": "hardened", "verdict": "gain +0.0051 > 0.0", "verdict_details": {"gain": 0.0050737657686706905}, "crash_reason": null, "summary": {"val_loss": 0.994786, "training_seconds": 300.0, "peak_mem_mb": 3915.6, "num_params_M": 19.5}, "edit_kind": "unknown", "edit": "width_minus", "hypothesis": "scripted unknown edit", "components": ["WIDTH"], "fix_attempts": 0, "crash_kind": null, "budget_event": null}, "t": 1790315848.3947873, "seq": 6}
{"id": "exp_edd87f1a94", "parent": "exp_db9a51ea49", "round": 7, "kind": "candidate", "status": "keep", "score": 0.9828070645795733, "cost": 3.8, "change": "WARMDOWN 0.5 -> 0.6", "artifact_id": "6b6a2c81195ced257104cfcd0c2563c023484b348073ee4fe1ba01dd0e9ff1db", "diff": "--- a/train.py\n+++ b/train.py\n@@ -7,7 +7,7 @@\n WIDTH = 320           # model dimension\n LR = 0.04             # peak learning rate\n BATCH = 256           # batch size\n-WARMDOWN = 0.5        # fraction of the budget spent decaying the LR\n+WARMDOWN = 0.6        # fraction of the budget spent decaying the LR\n WEIGHT_DECAY = 0.2\n INIT_SCALE = 1.0\n SEED = 42\n", "metrics": {"memory_gb": 3.8, "wall_s": 0.0, "samples": [0.9828070645795733], "val_epoch": 0, "truth": 0.9861888210854999}, "meta": {"commit": "6ab60c0", "program_version": "67a030e", "keep_rule": "strict", "mode": "hardened", "verdict": "gain +0.0120 > 0.0", "verdict_details": {"gain": 0.01197911278525099}, "crash_reason": null, "summary": {"val_loss": 0.982807, "training_seconds": 300.0, "peak_mem_mb": 3915.6, "num_params_M": 19.5}, "edit_kind": "unknown", "edit": "warmdown_up", "hypothesis": "scripted unknown edit", "components": ["WARMDOWN"], "fix_attempts": 0, "crash_kind": null, "budget_event": null}, "t": 1790315848.3963966, "seq": 7}
{"id": "exp_46e146b422", "parent": "exp_edd87f1a94", "round": 8, "kind": "candidate", "status": "discard", "score": 0.9839795961739343, "cost": 3.8, "change": "SEED 42 -> 397", "artifact_id": "3ee0bb102f19c1c5b9705040cc92058f5ec89277efe9daf59ea8d59eb90b268d", "diff": "--- a/train.py\n+++ b/train.py\n@@ -10,7 +10,7 @@\n WARMDOWN = 0.6        # fraction of the budget spent decaying the LR\n WEIGHT_DECAY = 0.2\n INIT_SCALE = 1.0\n-SEED = 42\n+SEED = 397\n \n if __name__ == \"__main__\":\n     import prepare\n", "metrics": {"memory_gb": 3.8, "wall_s": 0.0, "samples": [0.9839795961739343], "val_epoch": 0, "truth": 0.9861888210854999}, "meta": {"commit": "0420e88", "program_version": "67a030e", "keep_rule": "strict", "mode": "hardened", "verdict": "gain -0.0012 <= 0.0", "verdict_details": {"gain": -0.001172531594360926}, "crash_reason": null, "summary": {"val_loss": 0.98398, "training_seconds": 300.0, "peak_mem_mb": 3915.6, "num_params_M": 19.5}, "edit_kind": "neutral", "edit": "seed_change", "hypothesis": "scripted neutral edit", "components": ["SEED"], "fix_attempts": 0, "crash_kind": null, "budget_event": null}, "t": 1790315848.3984134, "seq": 8}
{"id": "exp_ad26582ecb", "parent": "exp_edd87f1a94", "round": 9, "kind": "candidate", "status": "discard", "score": 0.9832111999288083, "cost": 3.8, "change": "INIT_SCALE 1.0 -> 0.85", "artifact_id": "fdcce484a6394165c1e46346403f2f66f2e37bc019f5d63481f4adcddb1a3990", "diff": "--- a/train.py\n+++ b/train.py\n@@ -9,7 +9,7 @@\n BATCH = 256           # batch size\n WARMDOWN = 0.6        # fraction of the budget spent decaying the LR\n WEIGHT_DECAY = 0.2\n-INIT_SCALE = 1.0\n+INIT_SCALE = 0.85\n SEED = 42\n \n if __name__ == \"__main__\":\n", "metrics": {"memory_gb": 3.8, "wall_s": 0.0, "samples": [0.9832111999288083], "val_epoch": 0, "truth": 0.9832076194246743}, "meta": {"commit": "31cb74e", "program_version": "67a030e", "keep_rule": "strict", "mode": "hardened", "verdict": "gain -0.0004 <= 0.0", "verdict_details": {"gain": -0.00040413534923500194}, "crash_reason": null, "summary": {"val_loss": 0.983211, "training_seconds": 300.0, "peak_mem_mb": 3915.6, "num_params_M": 19.5}, "edit_kind": "unknown", "edit": "init_down", "hypothesis": "scripted unknown edit", "components": ["INIT_SCALE"], "fix_attempts": 0, "crash_kind": null, "budget_event": null}, "t": 1790315848.3999794, "seq": 9}
{"id": "exp_14b72a41c7", "parent": "exp_edd87f1a94", "round": 10, "kind": "candidate", "status": "discard", "score": 0.9887059330879873, "cost": 3.8, "change": "WARMDOWN 0.6 -> 0.7", "artifact_id": "64e79e0e8975f276741f14ab1238c5e906bbd4c38a70e760bb11ab0b75410c6e", "diff": "--- a/train.py\n+++ b/train.py\n@@ -7,7 +7,7 @@\n WIDTH = 320           # model dimension\n LR = 0.04             # peak learning rate\n BATCH = 256           # batch size\n-WARMDOWN = 0.6        # fraction of the budget spent decaying the LR\n+WARMDOWN = 0.7        # fraction of the budget spent decaying the LR\n WEIGHT_DECAY = 0.2\n INIT_SCALE = 1.0\n SEED = 42\n", "metrics": {"memory_gb": 3.8, "wall_s": 0.0, "samples": [0.9887059330879873], "val_epoch": 0, "truth": 0.9846888210854999}, "meta": {"commit": "c034dc9", "program_version": "67a030e", "keep_rule": "strict", "mode": "hardened", "verdict": "gain -0.0059 <= 0.0", "verdict_details": {"gain": -0.005898868508413924}, "crash_reason": null, "summary": {"val_loss": 0.988706, "training_seconds": 300.0, "peak_mem_mb": 3915.6, "num_params_M": 19.5}, "edit_kind": "unknown", "edit": "warmdown_up", "hypothesis": "scripted unknown edit", "components": ["WARMDOWN"], "fix_attempts": 0, "crash_kind": null, "budget_event": null}, "t": 1790315848.4013958, "seq": 10}
{"id": "exp_c67635a468", "parent": "exp_edd87f1a94", "round": 11, "kind": "candidate", "status": "keep", "score": 0.9686862046742992, "cost": 2.8, "change": "BATCH 256 -> 128", "artifact_id": "417bac168ccff607304d36fd12972e3b572ed7ecab35152219f17f17f1f02fb5", "diff": "--- a/train.py\n+++ b/train.py\n@@ -6,7 +6,7 @@\n DEPTH = 8             # layers\n WIDTH = 320           # model dimension\n LR = 0.04             # peak learning rate\n-BATCH = 256           # batch size\n+BATCH = 128           # batch size\n WARMDOWN = 0.6        # fraction of the budget spent decaying the LR\n WEIGHT_DECAY = 0.2\n INIT_SCALE = 1.0\n", "metrics": {"memory_gb": 2.8, "wall_s": 0.0, "samples": [0.9686862046742992], "val_epoch": 0, "truth": 0.9704765334650494}, "meta": {"commit": "ba6bbd9", "program_version": "67a030e", "keep_rule": "strict", "mode": "hardened", "verdict": "gain +0.0141 > 0.0", "verdict_details": {"gain": 0.014120859905274119}, "crash_reason": null, "summary": {"val_loss": 0.968686, "training_seconds": 300.0, "peak_mem_mb": 2885.9, "num_params_M": 19.5}, "edit_kind": "unknown", "edit": "batch_down", "hypothesis": "scripted unknown edit", "components": ["BATCH"], "fix_attempts": 0, "crash_kind": null, "budget_event": null}, "t": 1790315848.4030652, "seq": 11}
{"id": "exp_eb79a0dd0a", "parent": "exp_c67635a468", "round": 12, "kind": "candidate", "status": "discard", "score": 0.972725600848251, "cost": 2.1, "change": "BATCH 128 -> 64", "artifact_id": "8941119a31e853f34553bac4bca36e66570961cc7dc38882b4871d1cbfb4ae01", "diff": "--- a/train.py\n+++ b/train.py\n@@ -6,7 +6,7 @@\n DEPTH = 8             # layers\n WIDTH = 320           # model dimension\n LR = 0.04             # peak learning rate\n-BATCH = 128           # batch size\n+BATCH = 64           # batch size\n WARMDOWN = 0.6        # fraction of the budget spent decaying the LR\n WEIGHT_DECAY = 0.2\n INIT_SCALE = 1.0\n", "metrics": {"memory_gb": 2.1, "wall_s": 0.0, "samples": [0.972725600848251], "val_epoch": 0, "truth": 0.9687642458445987}, "meta": {"commit": "b576b35", "program_version": "67a030e", "keep_rule": "strict", "mode": "hardened", "verdict": "gain -0.0040 <= 0.0", "verdict_details": {"gain": -0.00403939617395177}, "crash_reason": null, "summary": {"val_loss": 0.972726, "training_seconds": 300.0, "peak_mem_mb": 2157.8, "num_params_M": 19.5}, "edit_kind": "unknown", "edit": "batch_down", "hypothesis": "scripted unknown edit", "components": ["BATCH"], "fix_attempts": 0, "crash_kind": null, "budget_event": null}, "t": 1790315848.4043858, "seq": 12}
{"id": "exp_7dcef70218", "parent": "exp_c67635a468", "round": 13, "kind": "candidate", "status": "keep", "score": 0.9643950222655364, "cost": 2.8, "change": "WARMDOWN 0.6 -> 0.7", "artifact_id": "e2c34ee50bc260babebd2b6f1d2b702048804b6344b385c2ba978da7197d5c84", "diff": "--- a/train.py\n+++ b/train.py\n@@ -7,7 +7,7 @@\n WIDTH = 320           # model dimension\n LR = 0.04             # peak learning rate\n BATCH = 128           # batch size\n-WARMDOWN = 0.6        # fraction of the budget spent decaying the LR\n+WARMDOWN = 0.7        # fraction of the budget spent decaying the LR\n WEIGHT_DECAY = 0.2\n INIT_SCALE = 1.0\n SEED = 42\n", "metrics": {"memory_gb": 2.8, "wall_s": 0.0, "samples": [0.9643950222655364], "val_epoch": 0, "truth": 0.9689765334650494}, "meta": {"commit": "4c18607", "program_version": "67a030e", "keep_rule": "strict", "mode": "hardened", "verdict": "gain +0.0043 > 0.0", "verdict_details": {"gain": 0.004291182408762806}, "crash_reason": null, "summary": {"val_loss": 0.964395, "training_seconds": 300.0, "peak_mem_mb": 2885.9, "num_params_M": 19.5}, "edit_kind": "unknown", "edit": "warmdown_up", "hypothesis": "scripted unknown edit", "components": ["WARMDOWN"], "fix_attempts": 0, "crash_kind": null, "budget_event": null}, "t": 1790315848.405702, "seq": 13}
{"id": "exp_fa5ac2f5a1", "parent": "exp_7dcef70218", "round": 14, "kind": "candidate", "status": "discard", "score": 0.9893874854298793, "cost": 3.8, "change": "BATCH 128 -> 256", "artifact_id": "64e79e0e8975f276741f14ab1238c5e906bbd4c38a70e760bb11ab0b75410c6e", "diff": "--- a/train.py\n+++ b/train.py\n@@ -6,7 +6,7 @@\n DEPTH = 8             # layers\n WIDTH = 320           # model dimension\n LR = 0.04             # peak learning rate\n-BATCH = 128           # batch size\n+BATCH = 256           # batch size\n WARMDOWN = 0.7        # fraction of the budget spent decaying the LR\n WEIGHT_DECAY = 0.2\n INIT_SCALE = 1.0\n", "metrics": {"memory_gb": 3.8, "wall_s": 0.0, "samples": [0.9893874854298793], "val_epoch": 0, "truth": 0.9846888210854999}, "meta": {"commit": "2644668", "program_version": "67a030e", "keep_rule": "strict", "mode": "hardened", "verdict": "gain -0.0250 <= 0.0", "verdict_details": {"gain": -0.024992463164342893}, "crash_reason": null, "summary": {"val_loss": 0.989387, "training_seconds": 300.0, "peak_mem_mb": 3915.6, "num_params_M": 19.5}, "edit_kind": "unknown", "edit": "batch_up", "hypothesis": "scripted unknown edit", "components": ["BATCH"], "fix_attempts": 0, "crash_kind": null, "budget_event": null}, "t": 1790315848.4069989, "seq": 14}
{"id": "exp_39789bdd5d", "parent": "exp_7dcef70218", "round": 15, "kind": "candidate", "status": "discard", "score": 0.9812148924525382, "cost": 3.9, "change": "WIDTH 320 -> 384", "artifact_id": "e3a3f2035ccbba329438befeebee215bb40f2b6150531f438cd7cbbb63808e41", "diff": "--- a/train.py\n+++ b/train.py\n@@ -4,7 +4,7 @@\n for the fixed budget and reports val_loss (lower is better).\n \"\"\"\n DEPTH = 8             # layers\n-WIDTH = 320           # model dimension\n+WIDTH = 384           # model dimension\n LR = 0.04             # peak learning rate\n BATCH = 128           # batch size\n WARMDOWN = 0.7        # fraction of the budget spent decaying the LR\n", "metrics": {"memory_gb": 3.9, "wall_s": 0.0, "samples": [0.9812148924525382], "val_epoch": 0, "truth": 0.9784718625756124}, "meta": {"commit": "9555599", "program_version": "67a030e", "keep_rule": "strict", "mode": "hardened", "verdict": "gain -0.0168 <= 0.0", "verdict_details": {"gain": -0.016819870187001817}, "crash_reason": null, "summary": {"val_loss": 0.981215, "training_seconds": 300.0, "peak_mem_mb": 3979.7, "num_params_M": 28.1}, "edit_kind": "unknown", "edit": "width_plus", "hypothesis": "scripted unknown edit", "components": ["WIDTH"], "fix_attempts": 0, "crash_kind": null, "budget_event": null}, "t": 1790315848.4083683, "seq": 15}
{"id": "exp_5e44906e33", "parent": "exp_7dcef70218", "round": 16, "kind": "candidate", "status": "discard", "score": 0.9730677019335535, "cost": 2.8, "change": "WARMDOWN 0.7 -> 0.8", "artifact_id": "daa28b5be69dbcffbfd5671bbbb905465f2ef6ba0d8b4d6aba21621fcd09e0da", "diff": "--- a/train.py\n+++ b/train.py\n@@ -7,7 +7,7 @@\n WIDTH = 320           # model dimension\n LR = 0.04             # peak learning rate\n BATCH = 128           # batch size\n-WARMDOWN = 0.7        # fraction of the budget spent decaying the LR\n+WARMDOWN = 0.8        # fraction of the budget spent decaying the LR\n WEIGHT_DECAY = 0.2\n INIT_SCALE = 1.0\n SEED = 42\n", "metrics": {"memory_gb": 2.8, "wall_s": 0.0, "samples": [0.9730677019335535], "val_epoch": 0, "truth": 0.9704765334650495}, "meta": {"commit": "89ccc7e", "program_version": "67a030e", "keep_rule": "strict", "mode": "hardened", "verdict": "gain -0.0087 <= 0.0", "verdict_details": {"gain": -0.008672679668017103}, "crash_reason": null, "summary": {"val_loss": 0.973068, "training_seconds": 300.0, "peak_mem_mb": 2885.9, "num_params_M": 19.5}, "edit_kind": "unknown", "edit": "warmdown_up", "hypothesis": "scripted unknown edit", "components": ["WARMDOWN"], "fix_attempts": 0, "crash_kind": null, "budget_event": null}, "t": 1790315848.409702, "seq": 16}
