{"id": "exp_2ffdd9e61c", "parent": "exp_1f3b49947a", "round": 16, "kind": "candidate", "status": "keep", "score": 2.5836099536523762, "cost": 0.1, "change": "LR 0.003 -> 0.006", "artifact_id": "c7af015871ee29e0e00e93f2b561c92ce8029d1e7a498e3b6a40a3dcc1ffe4b0", "diff": "--- a/train.py\n+++ b/train.py\n@@ -29,7 +29,7 @@\n BATCH_SIZE = 32          # rows per step\n TRAIN_SEQ_LEN = 16       # positions per row (examples per step = BATCH_SIZE * TRAIN_SEQ_LEN)\n OPTIMIZER = \"adam\"       # adam | sgd\n-LR = 0.003\n+LR = 0.006\n ADAM_BETAS = (0.9, 0.99)\n WEIGHT_DECAY = 0.0\n WARMUP_RATIO = 0.0\n", "metrics": {"memory_gb": 0.1, "wall_s": 8.539, "samples": [2.5836099536523762], "val_epoch": 0}, "meta": {"commit": "42d39be", "program_version": "67a030e", "keep_rule": "strict", "mode": "hardened", "verdict": "gain +0.1333 > 0.0", "verdict_details": {"gain": 0.1333399664371151}, "crash_reason": null, "summary": {"val_bpb": 2.58361, "training_seconds": 8.2, "total_seconds": 8.4, "peak_mem_mb": 92.5, "num_steps": 894.0, "num_params_M": 0.095, "depth": 1.0}, "edit_kind": "unknown", "edit": "lr_up", "hypothesis": "scripted unknown edit", "components": ["LR"], "fix_attempts": 0, "crash_kind": null, "budget_event": null, "audit": {"test_iid": 2.6715823386524593, "test_shift": 2.7216923245604394, "loop_metric_rerun": 2.576778073870382}}, "t": 1790333891.3234708, "seq": 16}
{"id": "exp_8310422b69", "parent": "exp_2ffdd9e61c", "round": 17, "kind": "candidate", "status": "keep", "score": 2.5184440504854417, "cost": 0.1, "change": "LR 0.006 -> 0.012", "artifact_id": "eee976585e33bd1a55dbb0ecd50c4ec1ca02bae4db67b72ef566046a9ec2b0a2", "diff": "--- a/train.py\n+++ b/train.py\n@@ -29,7 +29,7 @@\n BATCH_SIZE = 32          # rows per step\n TRAIN_SEQ_LEN = 16       # positions per row (examples per step = BATCH_SIZE * TRAIN_SEQ_LEN)\n OPTIMIZER = \"adam\"       # adam | sgd\n-LR = 0.006\n+LR = 0.012\n ADAM_BETAS = (0.9, 0.99)\n WEIGHT_DECAY = 0.0\n WARMUP_RATIO = 0.0\n", "metrics": {"memory_gb": 0.1, "wall_s": 8.636, "samples": [2.5184440504854417], "val_epoch": 0}, "meta": {"commit": "40d7955", "program_version": "67a030e", "keep_rule": "strict", "mode": "hardened", "verdict": "gain +0.0652 > 0.0", "verdict_details": {"gain": 0.06516590316693449}, "crash_reason": null, "summary": {"val_bpb": 2.518444, "training_seconds": 8.2, "total_seconds": 8.5, "peak_mem_mb": 91.6, "num_steps": 916.0, "num_params_M": 0.095, "depth": 1.0}, "edit_kind": "unknown", "edit": "lr_up", "hypothesis": "scripted unknown edit", "components": ["LR"], "fix_attempts": 0, "crash_kind": null, "budget_event": null, "audit": {"test_iid": 2.630675907827316, "test_shift": 2.6736324405752425, "loop_metric_rerun": 2.5317790713590225}}, "t": 1790333909.012484, "seq": 17}
{"id": "exp_782fc572f0", "parent": "exp_8310422b69", "round": 24, "kind": "candidate", "status": "keep", "score": 2.5172112370405184, "cost": 0.1, "change": "CONTEXT 6 -> 4", "artifact_id": "ee41425a1a342982fb128f8cead5a66df1a5dd7b91db75c11d9f468611fa1009", "diff": "--- a/train.py\n+++ b/train.py\n@@ -21,7 +21,7 @@\n # ---------------------------------------------------------------------------\n # Hyperparameters (edit these)\n # ---------------------------------------------------------------------------\n-CONTEXT = 6              # bytes of history the model sees\n+CONTEXT = 4              # bytes of history the model sees\n EMBED_DIM = 16           # byte embedding size\n HIDDEN = 256             # width of each hidden layer\n DEPTH = 1                # number of hidden layers\n", "metrics": {"memory_gb": 0.1, "wall_s": 8.639, "samples": [2.5172112370405184], "val_epoch": 0}, "meta": {"commit": "7a38ff1", "program_version": "67a030e", "keep_rule": "strict", "mode": "hardened", "verdict": "gain +0.0012 > 0.0", "verdict_details": {"gain": 0.0012328134449233197}, "crash_reason": null, "summary": {"val_bpb": 2.517211, "training_seconds": 8.2, "total_seconds": 8.5, "peak_mem_mb": 92.7, "num_steps": 942.0, "num_params_M": 0.087, "depth": 1.0}, "edit_kind": "unknown", "edit": "context_down", "hypothesis": "scripted unknown edit", "components": ["CONTEXT"], "fix_attempts": 0, "crash_kind": null, "budget_event": null, "audit": {"test_iid": 2.6074416814994055, "test_shift": 2.663245496938551, "loop_metric_rerun": 2.518054170289731}}, "t": 1790333961.0503547, "seq": 24}
