{"id": "exp_ae64202ad7", "parent": null, "round": 0, "kind": "baseline", "status": "keep", "score": 2.8383331236272045, "cost": 0.1, "change": "baseline", "artifact_id": "c3640d1810ba08961be266e3025f3f94b0bf06e7ee27a3ba2d400b7fff280d33", "diff": "", "metrics": {"memory_gb": 0.1, "wall_s": 8.559, "samples": [2.8383331236272045], "val_epoch": 0}, "meta": {"commit": "906744c", "program_version": "67a030e", "keep_rule": "strict", "mode": "hardened", "verdict": null, "verdict_details": null, "crash_reason": null, "summary": {"val_bpb": 2.838333, "training_seconds": 8.2, "total_seconds": 8.4, "peak_mem_mb": 81.0, "num_steps": 1364.0, "num_params_M": 0.05, "depth": 1.0}}, "t": 1790333674.0963752, "seq": 0}
{"id": "exp_ae64202ad7", "parent": null, "round": 0, "kind": "baseline", "status": "keep", "score": 2.8383331236272045, "cost": 0.1, "change": "baseline", "artifact_id": "c3640d1810ba08961be266e3025f3f94b0bf06e7ee27a3ba2d400b7fff280d33", "diff": "", "metrics": {"memory_gb": 0.1, "wall_s": 8.559, "samples": [2.8383331236272045], "val_epoch": 0}, "meta": {"commit": "906744c", "program_version": "67a030e", "keep_rule": "strict", "mode": "hardened", "verdict": null, "verdict_details": null, "crash_reason": null, "summary": {"val_bpb": 2.838333, "training_seconds": 8.2, "total_seconds": 8.4, "peak_mem_mb": 81.0, "num_steps": 1364.0, "num_params_M": 0.05, "depth": 1.0}, "noise": {"delta": 0.03454203915020159, "sd_null": 0.017271019575100795, "z": 2.0, "mode": "repeat", "n": 4}, "noise_runs": [2.855072182303389, 2.8377082471765553, 2.825323322865103, 2.8383331236272045]}, "t": 1790333674.0963752, "seq": 0}
{"id": "exp_03448717be", "parent": "exp_ae64202ad7", "round": 1, "kind": "candidate", "status": "discard", "score": 2.8622838977576324, "cost": 0.1, "change": "WEIGHT_DECAY 0.0 -> 0.0001", "artifact_id": "4bcd2006c7aa6eadd77a1b37122dec7980a12066cbfc7566b47ef812684c8b65", "diff": "--- a/train.py\n+++ b/train.py\n@@ -31,7 +31,7 @@\n OPTIMIZER = \"adam\"       # adam | sgd\n LR = 0.003\n ADAM_BETAS = (0.9, 0.99)\n-WEIGHT_DECAY = 0.0\n+WEIGHT_DECAY = 0.0001\n WARMUP_RATIO = 0.0\n WARMDOWN_RATIO = 0.5\n FINAL_LR_FRAC = 0.0\n", "metrics": {"memory_gb": 0.1, "wall_s": 8.567, "samples": [2.8622838977576324], "val_epoch": 0}, "meta": {"commit": "d8d2d09", "program_version": "67a030e", "keep_rule": "strict", "mode": "hardened", "verdict": "gain -0.0240 <= 0.0", "verdict_details": {"gain": -0.0239507741304279}, "crash_reason": null, "summary": {"val_bpb": 2.862284, "training_seconds": 8.1, "total_seconds": 8.5, "peak_mem_mb": 82.4, "num_steps": 1309.0, "num_params_M": 0.05, "depth": 1.0}, "edit_kind": "unknown", "edit": "wd_up", "hypothesis": "scripted unknown edit", "components": ["WEIGHT_DECAY"], "fix_attempts": 0, "crash_kind": null, "budget_event": null}, "t": 1790333717.2592747, "seq": 1}
{"id": "exp_756cb13f5e", "parent": "exp_ae64202ad7", "round": 2, "kind": "candidate", "status": "discard", "score": 2.946392450971731, "cost": 0.1, "change": "TRAIN_SEQ_LEN 16 -> 32", "artifact_id": "5d977dc582e0a65ce9a1b127d757532e9970ddc2865f558095c83054fcdd040f", "diff": "--- a/train.py\n+++ b/train.py\n@@ -27,7 +27,7 @@\n DEPTH = 1                # number of hidden layers\n ACTIVATION = \"tanh\"      # tanh | relu\n BATCH_SIZE = 32          # rows per step\n-TRAIN_SEQ_LEN = 16       # positions per row (examples per step = BATCH_SIZE * TRAIN_SEQ_LEN)\n+TRAIN_SEQ_LEN = 32       # positions per row (examples per step = BATCH_SIZE * TRAIN_SEQ_LEN)\n OPTIMIZER = \"adam\"       # adam | sgd\n LR = 0.003\n ADAM_BETAS = (0.9, 0.99)\n", "metrics": {"memory_gb": 0.1, "wall_s": 8.539, "samples": [2.946392450971731], "val_epoch": 0}, "meta": {"commit": "78787ed", "program_version": "67a030e", "keep_rule": "strict", "mode": "hardened", "verdict": "gain -0.1081 <= 0.0", "verdict_details": {"gain": -0.1080593273445265}, "crash_reason": null, "summary": {"val_bpb": 2.946392, "training_seconds": 8.2, "total_seconds": 8.4, "peak_mem_mb": 78.7, "num_steps": 733.0, "num_params_M": 0.05, "depth": 1.0}, "edit_kind": "unknown", "edit": "seq_up", "hypothesis": "scripted unknown edit", "components": ["TRAIN_SEQ_LEN"], "fix_attempts": 0, "crash_kind": null, "budget_event": null}, "t": 1790333725.804289, "seq": 2}
{"id": "exp_5c5e978afb", "parent": "exp_ae64202ad7", "round": 3, "kind": "candidate", "status": "discard", "score": 3.0188200524281, "cost": 0.1, "change": "EMBED_DIM 16 -> 8", "artifact_id": "70088094e42dd199b81caf9d4d7a82f7e52e014f61650d204c684f7e6a1d0124", "diff": "--- a/train.py\n+++ b/train.py\n@@ -22,7 +22,7 @@\n # Hyperparameters (edit these)\n # ---------------------------------------------------------------------------\n CONTEXT = 6              # bytes of history the model sees\n-EMBED_DIM = 16           # byte embedding size\n+EMBED_DIM = 8           # byte embedding size\n HIDDEN = 128             # width of each hidden layer\n DEPTH = 1                # number of hidden layers\n ACTIVATION = \"tanh\"      # tanh | relu\n", "metrics": {"memory_gb": 0.1, "wall_s": 8.537, "samples": [3.0188200524281], "val_epoch": 0}, "meta": {"commit": "66b1ff5", "program_version": "67a030e", "keep_rule": "strict", "mode": "hardened", "verdict": "gain -0.1805 <= 0.0", "verdict_details": {"gain": -0.18048692880089545}, "crash_reason": null, "summary": {"val_bpb": 3.01882, "training_seconds": 8.1, "total_seconds": 8.4, "peak_mem_mb": 78.8, "num_steps": 1464.0, "num_params_M": 0.041, "depth": 1.0}, "edit_kind": "unknown", "edit": "embed_down", "hypothesis": "scripted unknown edit", "components": ["EMBED_DIM"], "fix_attempts": 0, "crash_kind": null, "budget_event": null}, "t": 1790333734.3471293, "seq": 3}
{"id": "exp_1b50b83fc8", "parent": "exp_ae64202ad7", "round": 4, "kind": "candidate", "status": "discard", "score": 2.8436268373463154, "cost": 0.1, "change": "HIDDEN 128 -> 256", "artifact_id": "4454aaad6cf5020a3d10678101063cd18c3f0e9698c257f42109bc8221acc2af", "diff": "--- a/train.py\n+++ b/train.py\n@@ -23,7 +23,7 @@\n # ---------------------------------------------------------------------------\n CONTEXT = 6              # bytes of history the model sees\n EMBED_DIM = 16           # byte embedding size\n-HIDDEN = 128             # width of each hidden layer\n+HIDDEN = 256             # width of each hidden layer\n DEPTH = 1                # number of hidden layers\n ACTIVATION = \"tanh\"      # tanh | relu\n BATCH_SIZE = 32          # rows per step\n", "metrics": {"memory_gb": 0.1, "wall_s": 8.676, "samples": [2.8436268373463154], "val_epoch": 0}, "meta": {"commit": "d1d7d73", "program_version": "67a030e", "keep_rule": "strict", "mode": "hardened", "verdict": "gain -0.0053 <= 0.0", "verdict_details": {"gain": -0.005293713719110915}, "crash_reason": null, "summary": {"val_bpb": 2.843627, "training_seconds": 8.2, "total_seconds": 8.6, "peak_mem_mb": 93.1, "num_steps": 854.0, "num_params_M": 0.095, "depth": 1.0}, "edit_kind": "unknown", "edit": "hidden_up", "hypothesis": "scripted unknown edit", "components": ["HIDDEN"], "fix_attempts": 0, "crash_kind": null, "budget_event": null}, "t": 1790333743.0281713, "seq": 4}
{"id": "exp_78cd02899d", "parent": "exp_ae64202ad7", "round": 5, "kind": "candidate", "status": "keep", "score": 2.804627952738756, "cost": 0.1, "change": "ACTIVATION 'tanh' -> 'relu'", "artifact_id": "55a3cdc990068c80994533b2b4d21ec976dc4cd709750228a1bc6cd1d103bd41", "diff": "--- a/train.py\n+++ b/train.py\n@@ -25,7 +25,7 @@\n EMBED_DIM = 16           # byte embedding size\n HIDDEN = 128             # width of each hidden layer\n DEPTH = 1                # number of hidden layers\n-ACTIVATION = \"tanh\"      # tanh | relu\n+ACTIVATION = 'relu'      # tanh | relu\n BATCH_SIZE = 32          # rows per step\n TRAIN_SEQ_LEN = 16       # positions per row (examples per step = BATCH_SIZE * TRAIN_SEQ_LEN)\n OPTIMIZER = \"adam\"       # adam | sgd\n", "metrics": {"memory_gb": 0.1, "wall_s": 8.493, "samples": [2.804627952738756], "val_epoch": 0}, "meta": {"commit": "abaac1d", "program_version": "67a030e", "keep_rule": "strict", "mode": "hardened", "verdict": "gain +0.0337 > 0.0", "verdict_details": {"gain": 0.0337051708884486}, "crash_reason": null, "summary": {"val_bpb": 2.804628, "training_seconds": 8.1, "total_seconds": 8.4, "peak_mem_mb": 78.0, "num_steps": 1395.0, "num_params_M": 0.05, "depth": 1.0}, "edit_kind": "unknown", "edit": "activation_swap", "hypothesis": "scripted unknown edit", "components": ["ACTIVATION"], "fix_attempts": 0, "crash_kind": null, "budget_event": null}, "t": 1790333751.52645, "seq": 5}
{"id": "exp_d51a611ff6", "parent": "exp_78cd02899d", "round": 6, "kind": "candidate", "status": "discard", "score": 2.8387500997757527, "cost": 0.1, "change": "ACTIVATION 'relu' -> 'tanh'", "artifact_id": "103c47a5d1502bf8fa4eaf4528be287699b7f15880669b45bde4f2c9ce990209", "diff": "--- a/train.py\n+++ b/train.py\n@@ -25,7 +25,7 @@\n EMBED_DIM = 16           # byte embedding size\n HIDDEN = 128             # width of each hidden layer\n DEPTH = 1                # number of hidden layers\n-ACTIVATION = 'relu'      # tanh | relu\n+ACTIVATION = 'tanh'      # tanh | relu\n BATCH_SIZE = 32          # rows per step\n TRAIN_SEQ_LEN = 16       # positions per row (examples per step = BATCH_SIZE * TRAIN_SEQ_LEN)\n OPTIMIZER = \"adam\"       # adam | sgd\n", "metrics": {"memory_gb": 0.1, "wall_s": 8.519, "samples": [2.8387500997757527], "val_epoch": 0}, "meta": {"commit": "d35e819", "program_version": "67a030e", "keep_rule": "strict", "mode": "hardened", "verdict": "gain -0.0341 <= 0.0", "verdict_details": {"gain": -0.034122147036996786}, "crash_reason": null, "summary": {"val_bpb": 2.83875, "training_seconds": 8.1, "total_seconds": 8.4, "peak_mem_mb": 81.0, "num_steps": 1356.0, "num_params_M": 0.05, "depth": 1.0}, "edit_kind": "unknown", "edit": "activation_swap", "hypothesis": "scripted unknown edit", "components": ["ACTIVATION"], "fix_attempts": 0, "crash_kind": null, "budget_event": null}, "t": 1790333768.8890526, "seq": 6}
{"id": "exp_35e57798f1", "parent": "exp_78cd02899d", "round": 7, "kind": "candidate", "status": "discard", "score": 2.836544677568721, "cost": 0.1, "change": "WEIGHT_DECAY 0.0 -> 0.0001", "artifact_id": "cf4576ba7fc22a81e324923fc5e4e618f6cfd03c5269ef2ed881d3fd520a7dfe", "diff": "--- a/train.py\n+++ b/train.py\n@@ -31,7 +31,7 @@\n OPTIMIZER = \"adam\"       # adam | sgd\n LR = 0.003\n ADAM_BETAS = (0.9, 0.99)\n-WEIGHT_DECAY = 0.0\n+WEIGHT_DECAY = 0.0001\n WARMUP_RATIO = 0.0\n WARMDOWN_RATIO = 0.5\n FINAL_LR_FRAC = 0.0\n", "metrics": {"memory_gb": 0.1, "wall_s": 8.522, "samples": [2.836544677568721], "val_epoch": 0}, "meta": {"commit": "e08ac66", "program_version": "67a030e", "keep_rule": "strict", "mode": "hardened", "verdict": "gain -0.0319 <= 0.0", "verdict_details": {"gain": -0.031916724829965215}, "crash_reason": null, "summary": {"val_bpb": 2.836545, "training_seconds": 8.1, "total_seconds": 8.4, "peak_mem_mb": 76.8, "num_steps": 1294.0, "num_params_M": 0.05, "depth": 1.0}, "edit_kind": "unknown", "edit": "wd_up", "hypothesis": "scripted unknown edit", "components": ["WEIGHT_DECAY"], "fix_attempts": 0, "crash_kind": null, "budget_event": null}, "t": 1790333777.4156559, "seq": 7}
{"id": "exp_b216e01e03", "parent": "exp_78cd02899d", "round": 8, "kind": "candidate", "status": "discard", "score": 2.9035380470043015, "cost": 0.1, "change": "TRAIN_SEQ_LEN 16 -> 32", "artifact_id": "a95ab642224812cefb8d240800774b7cf8712b21dac797dbb81ff85d98159a46", "diff": "--- a/train.py\n+++ b/train.py\n@@ -27,7 +27,7 @@\n DEPTH = 1                # number of hidden layers\n ACTIVATION = 'relu'      # tanh | relu\n BATCH_SIZE = 32          # rows per step\n-TRAIN_SEQ_LEN = 16       # positions per row (examples per step = BATCH_SIZE * TRAIN_SEQ_LEN)\n+TRAIN_SEQ_LEN = 32       # positions per row (examples per step = BATCH_SIZE * TRAIN_SEQ_LEN)\n OPTIMIZER = \"adam\"       # adam | sgd\n LR = 0.003\n ADAM_BETAS = (0.9, 0.99)\n", "metrics": {"memory_gb": 0.1, "wall_s": 8.564, "samples": [2.9035380470043015], "val_epoch": 0}, "meta": {"commit": "674ba03", "program_version": "67a030e", "keep_rule": "strict", "mode": "hardened", "verdict": "gain -0.0989 <= 0.0", "verdict_details": {"gain": -0.09891009426554564}, "crash_reason": null, "summary": {"val_bpb": 2.903538, "training_seconds": 8.2, "total_seconds": 8.5, "peak_mem_mb": 81.4, "num_steps": 721.0, "num_params_M": 0.05, "depth": 1.0}, "edit_kind": "unknown", "edit": "seq_up", "hypothesis": "scripted unknown edit", "components": ["TRAIN_SEQ_LEN"], "fix_attempts": 0, "crash_kind": null, "budget_event": null}, "t": 1790333785.984117, "seq": 8}
{"id": "exp_dcafcaf336", "parent": "exp_78cd02899d", "round": 9, "kind": "candidate", "status": "keep", "score": 2.7969245116587658, "cost": 0.1, "change": "SEED 42 -> 397", "artifact_id": "e7c5fd6818dfcbf29d29d943d41245c5dc2db8e3875bc3c3b45f86bde57836f9", "diff": "--- a/train.py\n+++ b/train.py\n@@ -37,7 +37,7 @@\n FINAL_LR_FRAC = 0.0\n INIT_SCALE = 1.0\n EVAL_BATCH_SIZE = 64\n-SEED = 42\n+SEED = 397\n \n \n # ---------------------------------------------------------------------------\n", "metrics": {"memory_gb": 0.1, "wall_s": 8.492, "samples": [2.7969245116587658], "val_epoch": 0}, "meta": {"commit": "0137708", "program_version": "67a030e", "keep_rule": "strict", "mode": "hardened", "verdict": "gain +0.0077 > 0.0", "verdict_details": {"gain": 0.007703441079990103}, "crash_reason": null, "summary": {"val_bpb": 2.796925, "training_seconds": 8.1, "total_seconds": 8.4, "peak_mem_mb": 78.0, "num_steps": 1403.0, "num_params_M": 0.05, "depth": 1.0}, "edit_kind": "neutral", "edit": "seed_change", "hypothesis": "scripted neutral edit", "components": ["SEED"], "fix_attempts": 0, "crash_kind": null, "budget_event": null}, "t": 1790333794.4827888, "seq": 9}
{"id": "exp_d6b443d024", "parent": "exp_dcafcaf336", "round": 10, "kind": "candidate", "status": "keep", "score": 2.7575423379795714, "cost": 0.1, "change": "HIDDEN 128 -> 256", "artifact_id": "05a7b7bd799b789d17c4f49e53c8fad4482cc3f11214b025ddf8b4b94091be82", "diff": "--- a/train.py\n+++ b/train.py\n@@ -23,7 +23,7 @@\n # ---------------------------------------------------------------------------\n CONTEXT = 6              # bytes of history the model sees\n EMBED_DIM = 16           # byte embedding size\n-HIDDEN = 128             # width of each hidden layer\n+HIDDEN = 256             # width of each hidden layer\n DEPTH = 1                # number of hidden layers\n ACTIVATION = 'relu'      # tanh | relu\n BATCH_SIZE = 32          # rows per step\n", "metrics": {"memory_gb": 0.1, "wall_s": 8.564, "samples": [2.7575423379795714], "val_epoch": 0}, "meta": {"commit": "63a7f63", "program_version": "67a030e", "keep_rule": "strict", "mode": "hardened", "verdict": "gain +0.0394 > 0.0", "verdict_details": {"gain": 0.03938217367919439}, "crash_reason": null, "summary": {"val_bpb": 2.757542, "training_seconds": 8.2, "total_seconds": 8.5, "peak_mem_mb": 92.5, "num_steps": 882.0, "num_params_M": 0.095, "depth": 1.0}, "edit_kind": "unknown", "edit": "hidden_up", "hypothesis": "scripted unknown edit", "components": ["HIDDEN"], "fix_attempts": 0, "crash_kind": null, "budget_event": null}, "t": 1790333811.8883827, "seq": 10}
{"id": "exp_ee053980de", "parent": "exp_d6b443d024", "round": 11, "kind": "candidate", "status": "keep", "score": 2.7348958973280135, "cost": 0.1, "change": "WARMDOWN_RATIO 0.5 -> 0.3", "artifact_id": "0971fa57abc5258b3b623134be5db2dd1a5e26995940c5f4cb12da3c9dd3577e", "diff": "--- a/train.py\n+++ b/train.py\n@@ -33,7 +33,7 @@\n ADAM_BETAS = (0.9, 0.99)\n WEIGHT_DECAY = 0.0\n WARMUP_RATIO = 0.0\n-WARMDOWN_RATIO = 0.5\n+WARMDOWN_RATIO = 0.3\n FINAL_LR_FRAC = 0.0\n INIT_SCALE = 1.0\n EVAL_BATCH_SIZE = 64\n", "metrics": {"memory_gb": 0.1, "wall_s": 8.555, "samples": [2.7348958973280135], "val_epoch": 0}, "meta": {"commit": "3e8f0ff", "program_version": "67a030e", "keep_rule": "strict", "mode": "hardened", "verdict": "gain +0.0226 > 0.0", "verdict_details": {"gain": 0.022646440651557853}, "crash_reason": null, "summary": {"val_bpb": 2.734896, "training_seconds": 8.2, "total_seconds": 8.5, "peak_mem_mb": 91.7, "num_steps": 865.0, "num_params_M": 0.095, "depth": 1.0}, "edit_kind": "unknown", "edit": "warmdown_down", "hypothesis": "scripted unknown edit", "components": ["WARMDOWN_RATIO"], "fix_attempts": 0, "crash_kind": null, "budget_event": null}, "t": 1790333829.696546, "seq": 11}
{"id": "exp_1f3b49947a", "parent": "exp_ee053980de", "round": 12, "kind": "candidate", "status": "keep", "score": 2.7169499200894913, "cost": 0.1, "change": "WARMDOWN_RATIO 0.3 -> 0.1", "artifact_id": "12244b3ef432807e49979bd31f8786b2fbc76db7cdbcbd2de504be60da893cd9", "diff": "--- a/train.py\n+++ b/train.py\n@@ -33,7 +33,7 @@\n ADAM_BETAS = (0.9, 0.99)\n WEIGHT_DECAY = 0.0\n WARMUP_RATIO = 0.0\n-WARMDOWN_RATIO = 0.3\n+WARMDOWN_RATIO = 0.1\n FINAL_LR_FRAC = 0.0\n INIT_SCALE = 1.0\n EVAL_BATCH_SIZE = 64\n", "metrics": {"memory_gb": 0.1, "wall_s": 8.605, "samples": [2.7169499200894913], "val_epoch": 0}, "meta": {"commit": "518197b", "program_version": "67a030e", "keep_rule": "strict", "mode": "hardened", "verdict": "gain +0.0179 > 0.0", "verdict_details": {"gain": 0.017945977238522204}, "crash_reason": null, "summary": {"val_bpb": 2.71695, "training_seconds": 8.2, "total_seconds": 8.5, "peak_mem_mb": 91.6, "num_steps": 881.0, "num_params_M": 0.095, "depth": 1.0}, "edit_kind": "unknown", "edit": "warmdown_down", "hypothesis": "scripted unknown edit", "components": ["WARMDOWN_RATIO"], "fix_attempts": 0, "crash_kind": null, "budget_event": null}, "t": 1790333847.2785835, "seq": 12}
{"id": "exp_401191fa3e", "parent": "exp_1f3b49947a", "round": 13, "kind": "candidate", "status": "discard", "score": 2.736551365657844, "cost": 0.1, "change": "ADAM_BETAS (0.9, 0.99) -> (0.8, 0.95)", "artifact_id": "15d17bf17b7c061f07c5628945989f9bbf2187a6067e7c1ed24729eeded6fd60", "diff": "--- a/train.py\n+++ b/train.py\n@@ -30,7 +30,7 @@\n TRAIN_SEQ_LEN = 16       # positions per row (examples per step = BATCH_SIZE * TRAIN_SEQ_LEN)\n OPTIMIZER = \"adam\"       # adam | sgd\n LR = 0.003\n-ADAM_BETAS = (0.9, 0.99)\n+ADAM_BETAS = (0.8, 0.95)\n WEIGHT_DECAY = 0.0\n WARMUP_RATIO = 0.0\n WARMDOWN_RATIO = 0.1\n", "metrics": {"memory_gb": 0.1, "wall_s": 8.671, "samples": [2.736551365657844], "val_epoch": 0}, "meta": {"commit": "cc2c08d", "program_version": "67a030e", "keep_rule": "strict", "mode": "hardened", "verdict": "gain -0.0196 <= 0.0", "verdict_details": {"gain": -0.019601445568352638}, "crash_reason": null, "summary": {"val_bpb": 2.736551, "training_seconds": 8.2, "total_seconds": 8.6, "peak_mem_mb": 91.7, "num_steps": 872.0, "num_params_M": 0.095, "depth": 1.0}, "edit_kind": "unknown", "edit": "betas_swap", "hypothesis": "scripted unknown edit", "components": ["ADAM_BETAS"], "fix_attempts": 0, "crash_kind": null, "budget_event": null}, "t": 1790333865.2127323, "seq": 13}
{"id": "exp_fe124530fb", "parent": "exp_1f3b49947a", "round": 14, "kind": "candidate", "status": "discard", "score": 2.7432937729605977, "cost": 0.1, "change": "CONTEXT 6 -> 8", "artifact_id": "83bc8c69b8790554e59b051e33d020bd0a7157cf160fefc8f9c792b1f9206254", "diff": "--- a/train.py\n+++ b/train.py\n@@ -21,7 +21,7 @@\n # ---------------------------------------------------------------------------\n # Hyperparameters (edit these)\n # ---------------------------------------------------------------------------\n-CONTEXT = 6              # bytes of history the model sees\n+CONTEXT = 8              # bytes of history the model sees\n EMBED_DIM = 16           # byte embedding size\n HIDDEN = 256             # width of each hidden layer\n DEPTH = 1                # number of hidden layers\n", "metrics": {"memory_gb": 0.1, "wall_s": 8.724, "samples": [2.7432937729605977], "val_epoch": 0}, "meta": {"commit": "45d9340", "program_version": "67a030e", "keep_rule": "strict", "mode": "hardened", "verdict": "gain -0.0263 <= 0.0", "verdict_details": {"gain": -0.02634385287110641}, "crash_reason": null, "summary": {"val_bpb": 2.743294, "training_seconds": 8.2, "total_seconds": 8.6, "peak_mem_mb": 92.3, "num_steps": 862.0, "num_params_M": 0.103, "depth": 1.0}, "edit_kind": "unknown", "edit": "context_up", "hypothesis": "scripted unknown edit", "components": ["CONTEXT"], "fix_attempts": 0, "crash_kind": null, "budget_event": null}, "t": 1790333873.9419024, "seq": 14}
{"id": "exp_72dc2404fd", "parent": "exp_1f3b49947a", "round": 15, "kind": "candidate", "status": "discard", "score": 2.8418440587835767, "cost": 0.1, "change": "TRAIN_SEQ_LEN 16 -> 32", "artifact_id": "657eb2728217dbe1cd0584eca5f850bb44c9620c1e5a52e2e9b292975e462a10", "diff": "--- a/train.py\n+++ b/train.py\n@@ -27,7 +27,7 @@\n DEPTH = 1                # number of hidden layers\n ACTIVATION = 'relu'      # tanh | relu\n BATCH_SIZE = 32          # rows per step\n-TRAIN_SEQ_LEN = 16       # positions per row (examples per step = BATCH_SIZE * TRAIN_SEQ_LEN)\n+TRAIN_SEQ_LEN = 32       # positions per row (examples per step = BATCH_SIZE * TRAIN_SEQ_LEN)\n OPTIMIZER = \"adam\"       # adam | sgd\n LR = 0.003\n ADAM_BETAS = (0.9, 0.99)\n", "metrics": {"memory_gb": 0.1, "wall_s": 8.833, "samples": [2.8418440587835767], "val_epoch": 0}, "meta": {"commit": "654b218", "program_version": "67a030e", "keep_rule": "strict", "mode": "hardened", "verdict": "gain -0.1249 <= 0.0", "verdict_details": {"gain": -0.12489413869408539}, "crash_reason": null, "summary": {"val_bpb": 2.841844, "training_seconds": 8.3, "total_seconds": 8.7, "peak_mem_mb": 95.5, "num_steps": 445.0, "num_params_M": 0.095, "depth": 1.0}, "edit_kind": "unknown", "edit": "seq_up", "hypothesis": "scripted unknown edit", "components": ["TRAIN_SEQ_LEN"], "fix_attempts": 0, "crash_kind": null, "budget_event": null}, "t": 1790333882.7791443, "seq": 15}
