{"id": "exp_c60b5811b2", "parent": null, "round": 0, "kind": "baseline", "status": "keep", "score": 2.8288339009396535, "cost": 0.1, "change": "baseline", "artifact_id": "c3640d1810ba08961be266e3025f3f94b0bf06e7ee27a3ba2d400b7fff280d33", "diff": "", "metrics": {"memory_gb": 0.1, "wall_s": 8.589, "samples": [2.8288339009396535], "val_epoch": 0}, "meta": {"commit": "906744c", "program_version": "67a030e", "keep_rule": "strict", "mode": "hardened", "verdict": null, "verdict_details": null, "crash_reason": null, "summary": {"val_bpb": 2.828834, "training_seconds": 8.2, "total_seconds": 8.5, "peak_mem_mb": 80.3, "num_steps": 1389.0, "num_params_M": 0.05, "depth": 1.0}}, "t": 1790340033.6830103, "seq": 0}
{"id": "exp_c60b5811b2", "parent": null, "round": 0, "kind": "baseline", "status": "keep", "score": 2.8288339009396535, "cost": 0.1, "change": "baseline", "artifact_id": "c3640d1810ba08961be266e3025f3f94b0bf06e7ee27a3ba2d400b7fff280d33", "diff": "", "metrics": {"memory_gb": 0.1, "wall_s": 8.589, "samples": [2.8288339009396535], "val_epoch": 0}, "meta": {"commit": "906744c", "program_version": "67a030e", "keep_rule": "strict", "mode": "hardened", "verdict": null, "verdict_details": null, "crash_reason": null, "summary": {"val_bpb": 2.828834, "training_seconds": 8.2, "total_seconds": 8.5, "peak_mem_mb": 80.3, "num_steps": 1389.0, "num_params_M": 0.05, "depth": 1.0}, "noise": {"delta": 0.025729782075366497, "sd_null": 0.012864891037683249, "z": 2.0, "mode": "repeat", "n": 4}, "noise_runs": [2.848039133521197, 2.838725401340871, 2.8293109526244846, 2.8288339009396535]}, "t": 1790340033.6830103, "seq": 0}
{"id": "exp_9a8b21883f", "parent": "exp_c60b5811b2", "round": 1, "kind": "candidate", "status": "discard", "score": 2.898957980534493, "cost": 0.1, "change": "Increase CONTEXT to 8 and HIDDEN to 160 for better representational capacity", "artifact_id": "8d813acbf194fb5c550a75ba91d8a17971d6344c8772f329e7a0947cca5da774", "diff": "--- a/train.py\n+++ b/train.py\n@@ -21,9 +21,9 @@\n # ---------------------------------------------------------------------------\n # Hyperparameters (edit these)\n # ---------------------------------------------------------------------------\n-CONTEXT = 6              # bytes of history the model sees\n+CONTEXT = 8              # bytes of history the model sees\n EMBED_DIM = 16           # byte embedding size\n-HIDDEN = 128             # width of each hidden layer\n+HIDDEN = 160             # width of each hidden layer\n DEPTH = 1                # number of hidden layers\n ACTIVATION = \"tanh\"      # tanh | relu\n BATCH_SIZE = 32          # rows per step\n", "metrics": {"memory_gb": 0.1, "wall_s": 8.682, "samples": [2.898957980534493], "val_epoch": 0}, "meta": {"commit": "5ec68a8", "program_version": "67a030e", "keep_rule": "strict", "mode": "hardened", "verdict": "gain -0.0701 <= 0.0", "verdict_details": {"gain": -0.07012407959483946}, "crash_reason": null, "summary": {"val_bpb": 2.898958, "training_seconds": 8.2, "total_seconds": 8.6, "peak_mem_mb": 85.5, "num_steps": 1032.0, "num_params_M": 0.066, "depth": 1.0}, "edit_kind": null, "edit": null, "hypothesis": "Byte-level text has short-range statistical patterns (punctuation, indentation, common word endings). Increasing context from 6 to 8 bytes gives the model more history to exploit these patterns. Wider hidden layer (160 vs 128) adds capacity to learn richer feature representations. Both changes use the fixed budget more effectively by training a better-tuned model rather than processing more raw data.", "components": ["hyperparameters", "model_architecture"], "fix_attempts": 0, "crash_kind": null, "budget_event": null}, "t": 1790340151.7643642, "seq": 1}
{"id": "exp_c5f1cc9e71", "parent": "exp_c60b5811b2", "round": 2, "kind": "candidate", "status": "discard", "score": 2.876920116657834, "cost": 0.1, "change": "Add L2 regularization (weight_decay=0.0001) to prevent overfitting after model size increase failed", "artifact_id": "4bcd2006c7aa6eadd77a1b37122dec7980a12066cbfc7566b47ef812684c8b65", "diff": "--- a/train.py\n+++ b/train.py\n@@ -31,7 +31,7 @@\n OPTIMIZER = \"adam\"       # adam | sgd\n LR = 0.003\n ADAM_BETAS = (0.9, 0.99)\n-WEIGHT_DECAY = 0.0\n+WEIGHT_DECAY = 0.0001\n WARMUP_RATIO = 0.0\n WARMDOWN_RATIO = 0.5\n FINAL_LR_FRAC = 0.0\n", "metrics": {"memory_gb": 0.1, "wall_s": 8.575, "samples": [2.876920116657834], "val_epoch": 0}, "meta": {"commit": "3c5b1c4", "program_version": "67a030e", "keep_rule": "strict", "mode": "hardened", "verdict": "gain -0.0481 <= 0.0", "verdict_details": {"gain": -0.048086215718180725}, "crash_reason": null, "summary": {"val_bpb": 2.87692, "training_seconds": 8.2, "total_seconds": 8.5, "peak_mem_mb": 79.0, "num_steps": 1256.0, "num_params_M": 0.05, "depth": 1.0}, "edit_kind": null, "edit": null, "hypothesis": "The previous experiment failed when increasing model capacity (HIDDEN 128\u2192160, CONTEXT 6\u21928), suggesting overfitting or poor optimization at larger scale. Adding mild L2 regularization should help with generalization without changing model structure. This is a conservative, well-established technique that addresses potential overfitting in the small-budget training regime.", "components": ["optimizer", "regularization"], "fix_attempts": 0, "crash_kind": null, "budget_event": null}, "t": 1790340252.6838489, "seq": 2}
{"id": "exp_9b2d39b77e", "parent": "exp_c60b5811b2", "round": 3, "kind": "candidate", "status": "keep", "score": 2.7399703598292153, "cost": 0.1, "change": "Increase learning rate from 0.003 to 0.004 for faster convergence within fixed budget", "artifact_id": "ed7f614abfe3f7f2f187b3ff151f904ffb020341cb8c4949f81f8fabf714fd73", "diff": "--- a/train.py\n+++ b/train.py\n@@ -29,7 +29,7 @@\n BATCH_SIZE = 32          # rows per step\n TRAIN_SEQ_LEN = 16       # positions per row (examples per step = BATCH_SIZE * TRAIN_SEQ_LEN)\n OPTIMIZER = \"adam\"       # adam | sgd\n-LR = 0.003\n+LR = 0.004\n ADAM_BETAS = (0.9, 0.99)\n WEIGHT_DECAY = 0.0\n WARMUP_RATIO = 0.0\n", "metrics": {"memory_gb": 0.1, "wall_s": 8.549, "samples": [2.7399703598292153], "val_epoch": 0}, "meta": {"commit": "a285d1a", "program_version": "67a030e", "keep_rule": "strict", "mode": "hardened", "verdict": "gain +0.0889 > 0.0", "verdict_details": {"gain": 0.08886354111043815}, "crash_reason": null, "summary": {"val_bpb": 2.73997, "training_seconds": 8.2, "total_seconds": 8.4, "peak_mem_mb": 80.2, "num_steps": 1449.0, "num_params_M": 0.05, "depth": 1.0}, "edit_kind": null, "edit": null, "hypothesis": "With a fixed 8-second training budget, increasing the learning rate should enable faster optimization convergence. Previous larger model attempts failed, suggesting the baseline architecture is good but might benefit from LR tuning. A modest 33% LR increase may help the optimizer find better minima before time expires, similar to how fixed-budget experiments often favor higher learning rates.", "components": ["hyperparameter", "optimizer"], "fix_attempts": 0, "crash_kind": null, "budget_event": null}, "t": 1790340353.7695012, "seq": 3}
{"id": "exp_c26bd08fb5", "parent": "exp_9b2d39b77e", "round": 4, "kind": "candidate", "status": "keep", "score": 2.6973124314861963, "cost": 0.1, "change": "Increase learning rate from 0.004 to 0.005 to further accelerate convergence", "artifact_id": "fda210b667d715345ac4e1d795b1c80c9938663688623da958a5838c17285903", "diff": "--- a/train.py\n+++ b/train.py\n@@ -29,7 +29,7 @@\n BATCH_SIZE = 32          # rows per step\n TRAIN_SEQ_LEN = 16       # positions per row (examples per step = BATCH_SIZE * TRAIN_SEQ_LEN)\n OPTIMIZER = \"adam\"       # adam | sgd\n-LR = 0.004\n+LR = 0.005\n ADAM_BETAS = (0.9, 0.99)\n WEIGHT_DECAY = 0.0\n WARMUP_RATIO = 0.0\n", "metrics": {"memory_gb": 0.1, "wall_s": 8.585, "samples": [2.6973124314861963], "val_epoch": 0}, "meta": {"commit": "533edda", "program_version": "67a030e", "keep_rule": "strict", "mode": "hardened", "verdict": "gain +0.0427 > 0.0", "verdict_details": {"gain": 0.04265792834301907}, "crash_reason": null, "summary": {"val_bpb": 2.697312, "training_seconds": 8.2, "total_seconds": 8.5, "peak_mem_mb": 81.5, "num_steps": 1426.0, "num_params_M": 0.05, "depth": 1.0}, "edit_kind": null, "edit": null, "hypothesis": "The previous LR increase from 0.003\u21920.004 improved val_bpb by ~0.09, suggesting we remain in the regime where higher learning rates help. A 25% increase to 0.005 should continue this trend within a fixed training budget where optimization is the bottleneck, not model capacity.", "components": ["hyperparameter", "optimizer"], "fix_attempts": 0, "crash_kind": null, "budget_event": null}, "t": 1790340471.5455554, "seq": 4}
{"id": "exp_cd3e48300f", "parent": "exp_c26bd08fb5", "round": 5, "kind": "candidate", "status": "discard", "score": 2.725566733628821, "cost": 0.1, "change": "Disable learning rate warmdown (WARMDOWN_RATIO: 0.5 \u2192 0.0) to keep LR constant throughout fixed budget", "artifact_id": "3e33ea61f79dab9f192490846e91ae2781751a99bdf07507bd25c386217a7ea5", "diff": "--- a/train.py\n+++ b/train.py\n@@ -33,7 +33,7 @@\n ADAM_BETAS = (0.9, 0.99)\n WEIGHT_DECAY = 0.0\n WARMUP_RATIO = 0.0\n-WARMDOWN_RATIO = 0.5\n+WARMDOWN_RATIO = 0.0\n FINAL_LR_FRAC = 0.0\n INIT_SCALE = 1.0\n EVAL_BATCH_SIZE = 64\n", "metrics": {"memory_gb": 0.1, "wall_s": 8.543, "samples": [2.725566733628821], "val_epoch": 0}, "meta": {"commit": "82bf089", "program_version": "67a030e", "keep_rule": "strict", "mode": "hardened", "verdict": "gain -0.0283 <= 0.0", "verdict_details": {"gain": -0.0282543021426247}, "crash_reason": null, "summary": {"val_bpb": 2.725567, "training_seconds": 8.1, "total_seconds": 8.4, "peak_mem_mb": 80.1, "num_steps": 1413.0, "num_params_M": 0.05, "depth": 1.0}, "edit_kind": null, "edit": null, "hypothesis": "With a fixed wall-clock budget and no validation-based early stopping, reducing LR in the later training phases wastes time that could be used for continued learning. Keeping LR constant should allow more effective optimization throughout the entire training window.", "components": ["hyperparameters", "training_loop"], "fix_attempts": 0, "crash_kind": null, "budget_event": null}, "t": 1790340576.6648636, "seq": 5}
{"id": "exp_7eafa6ddef", "parent": "exp_c26bd08fb5", "round": 6, "kind": "candidate", "status": "keep", "score": 2.666246678023838, "cost": 0.1, "change": "Reduce BATCH_SIZE from 32 to 16 to double training steps and data coverage within fixed budget", "artifact_id": "f6a383da5585c9371fe57a0279f60f4e4aaf6d4a11fa51d7dcdd2be2a9401e08", "diff": "--- a/train.py\n+++ b/train.py\n@@ -26,7 +26,7 @@\n HIDDEN = 128             # width of each hidden layer\n DEPTH = 1                # number of hidden layers\n ACTIVATION = \"tanh\"      # tanh | relu\n-BATCH_SIZE = 32          # rows per step\n+BATCH_SIZE = 16          # rows per step\n TRAIN_SEQ_LEN = 16       # positions per row (examples per step = BATCH_SIZE * TRAIN_SEQ_LEN)\n OPTIMIZER = \"adam\"       # adam | sgd\n LR = 0.005\n", "metrics": {"memory_gb": 0.1, "wall_s": 8.581, "samples": [2.666246678023838], "val_epoch": 0}, "meta": {"commit": "83d320f", "program_version": "67a030e", "keep_rule": "strict", "mode": "hardened", "verdict": "gain +0.0311 > 0.0", "verdict_details": {"gain": 0.03106575346235818}, "crash_reason": null, "summary": {"val_bpb": 2.666247, "training_seconds": 8.2, "total_seconds": 8.5, "peak_mem_mb": 79.3, "num_steps": 2484.0, "num_params_M": 0.05, "depth": 1.0}, "edit_kind": null, "edit": null, "hypothesis": "With a fixed 8-second budget and small, fixed training corpus, increasing the number of gradient updates (by halving batch size) should allow the model to see more training data iterations and converge better. Smaller batches with more frequent updates often outperform fewer large-batch updates when training time is constrained, even with noisier gradients.", "components": ["hyperparameters"], "fix_attempts": 0, "crash_kind": null, "budget_event": null}, "t": 1790340689.9150743, "seq": 6}
{"id": "exp_4665b54153", "parent": "exp_7eafa6ddef", "round": 7, "kind": "candidate", "status": "keep", "score": 2.6561396570905105, "cost": 0.1, "change": "Reduce BATCH_SIZE from 16 to 8 to enable more gradient steps within fixed budget", "artifact_id": "15fd2553001ef32f18051aa8f92f037dd8d22bce9700a1cf604245e50d56dd8b", "diff": "--- a/train.py\n+++ b/train.py\n@@ -26,7 +26,7 @@\n HIDDEN = 128             # width of each hidden layer\n DEPTH = 1                # number of hidden layers\n ACTIVATION = \"tanh\"      # tanh | relu\n-BATCH_SIZE = 16          # rows per step\n+BATCH_SIZE = 8           # rows per step\n TRAIN_SEQ_LEN = 16       # positions per row (examples per step = BATCH_SIZE * TRAIN_SEQ_LEN)\n OPTIMIZER = \"adam\"       # adam | sgd\n LR = 0.005\n", "metrics": {"memory_gb": 0.1, "wall_s": 8.726, "samples": [2.6561396570905105], "val_epoch": 0}, "meta": {"commit": "197ab6b", "program_version": "67a030e", "keep_rule": "strict", "mode": "hardened", "verdict": "gain +0.0101 > 0.0", "verdict_details": {"gain": 0.010107020933327604}, "crash_reason": null, "summary": {"val_bpb": 2.65614, "training_seconds": 8.2, "total_seconds": 8.6, "peak_mem_mb": 77.8, "num_steps": 4314.0, "num_params_M": 0.05, "depth": 1.0}, "edit_kind": null, "edit": null, "hypothesis": "Smaller batches provide more frequent parameter updates (2x more steps) and implicit regularization. The previous reduction 32\u219216 improved val_bpb by 0.031; continuing this trend should further improve convergence on the fixed budget. More steps may overcome any increase in gradient noise via Adam's adaptive learning rates.", "components": ["hyperparameter", "training_loop"], "fix_attempts": 0, "crash_kind": null, "budget_event": null}, "t": 1790340780.067334, "seq": 7}
{"id": "exp_1612982960", "parent": "exp_4665b54153", "round": 8, "kind": "candidate", "status": "discard", "score": 2.6906631919217388, "cost": 0.1, "change": "Reduce BATCH_SIZE from 8 to 4 to double gradient steps within fixed budget", "artifact_id": "13d5a94e304c614ef808ebb2331c60b92dc557c3787a75a1ff5a7fe010ab40b9", "diff": "--- a/train.py\n+++ b/train.py\n@@ -26,7 +26,7 @@\n HIDDEN = 128             # width of each hidden layer\n DEPTH = 1                # number of hidden layers\n ACTIVATION = \"tanh\"      # tanh | relu\n-BATCH_SIZE = 8           # rows per step\n+BATCH_SIZE = 4           # rows per step\n TRAIN_SEQ_LEN = 16       # positions per row (examples per step = BATCH_SIZE * TRAIN_SEQ_LEN)\n OPTIMIZER = \"adam\"       # adam | sgd\n LR = 0.005\n", "metrics": {"memory_gb": 0.1, "wall_s": 8.71, "samples": [2.6906631919217388], "val_epoch": 0}, "meta": {"commit": "bb1d08e", "program_version": "67a030e", "keep_rule": "strict", "mode": "hardened", "verdict": "gain -0.0345 <= 0.0", "verdict_details": {"gain": -0.034523534831228275}, "crash_reason": null, "summary": {"val_bpb": 2.690663, "training_seconds": 8.3, "total_seconds": 8.6, "peak_mem_mb": 77.4, "num_steps": 5781.0, "num_params_M": 0.05, "depth": 1.0}, "edit_kind": null, "edit": null, "hypothesis": "The pattern of BATCH_SIZE reductions (32\u219216\u21928) has consistently improved val_bpb by enabling more optimizer steps within the fixed 8-second budget. With BATCH_SIZE=4, we expect ~2x more steps (faster per-step computation with 4 samples vs 8), allowing better convergence in the same wall-clock time.", "components": ["hyperparameter_tuning"], "fix_attempts": 0, "crash_kind": null, "budget_event": null}, "t": 1790340871.4271374, "seq": 8}
{"id": "exp_d1030218da", "parent": "exp_4665b54153", "round": 9, "kind": "candidate", "status": "keep", "score": 2.6308254050878395, "cost": 0.1, "change": "Increase learning rate from 0.005 to 0.006 to further accelerate convergence", "artifact_id": "12ca9fd903bd78c715497c942b7a4bebdb3edfcb6ff6a3507aa1def7fd0b6c3d", "diff": "--- a/train.py\n+++ b/train.py\n@@ -29,7 +29,7 @@\n BATCH_SIZE = 8           # rows per step\n TRAIN_SEQ_LEN = 16       # positions per row (examples per step = BATCH_SIZE * TRAIN_SEQ_LEN)\n OPTIMIZER = \"adam\"       # adam | sgd\n-LR = 0.005\n+LR = 0.006\n ADAM_BETAS = (0.9, 0.99)\n WEIGHT_DECAY = 0.0\n WARMUP_RATIO = 0.0\n", "metrics": {"memory_gb": 0.1, "wall_s": 8.729, "samples": [2.6308254050878395], "val_epoch": 0}, "meta": {"commit": "020a551", "program_version": "67a030e", "keep_rule": "strict", "mode": "hardened", "verdict": "gain +0.0253 > 0.0", "verdict_details": {"gain": 0.02531425200267101}, "crash_reason": null, "summary": {"val_bpb": 2.630825, "training_seconds": 8.2, "total_seconds": 8.6, "peak_mem_mb": 77.4, "num_steps": 4412.0, "num_params_M": 0.05, "depth": 1.0}, "edit_kind": null, "edit": null, "hypothesis": "The sequence of LR increases (0.003 \u2192 0.004 \u2192 0.005) has consistently improved val_bpb with diminishing but still positive returns. Given that batch size tuning is saturating (4 was worse), the learning rate remains a promising axis. Pushing to 0.006 may find a better convergence point within the fixed budget, allowing more effective parameter updates in the early-to-mid phase of training before the warmdown schedule kicks in.", "components": ["hyperparameters"], "fix_attempts": 0, "crash_kind": null, "budget_event": null}, "t": 1790340985.9963934, "seq": 9}
{"id": "exp_920eda8b93", "parent": "exp_d1030218da", "round": 10, "kind": "candidate", "status": "keep", "score": 2.622188131367283, "cost": 0.1, "change": "Increase learning rate from 0.006 to 0.007 to further accelerate convergence", "artifact_id": "1fff31e8228a0ac5fa34554e8d6d1569198c9d29cf20584796150822e5b5f81b", "diff": "--- a/train.py\n+++ b/train.py\n@@ -29,7 +29,7 @@\n BATCH_SIZE = 8           # rows per step\n TRAIN_SEQ_LEN = 16       # positions per row (examples per step = BATCH_SIZE * TRAIN_SEQ_LEN)\n OPTIMIZER = \"adam\"       # adam | sgd\n-LR = 0.006\n+LR = 0.007\n ADAM_BETAS = (0.9, 0.99)\n WEIGHT_DECAY = 0.0\n WARMUP_RATIO = 0.0\n", "metrics": {"memory_gb": 0.1, "wall_s": 8.653, "samples": [2.622188131367283], "val_epoch": 0}, "meta": {"commit": "363363c", "program_version": "67a030e", "keep_rule": "strict", "mode": "hardened", "verdict": "gain +0.0086 > 0.0", "verdict_details": {"gain": 0.00863727372055667}, "crash_reason": null, "summary": {"val_bpb": 2.622188, "training_seconds": 8.2, "total_seconds": 8.6, "peak_mem_mb": 77.4, "num_steps": 4430.0, "num_params_M": 0.05, "depth": 1.0}, "edit_kind": null, "edit": null, "hypothesis": "The learning rate trend shows consistent improvement: 0.003\u21920.004 (+0.088), 0.004\u21920.005 (+0.043), 0.005\u21920.006 (+0.066). The last jump was substantial, suggesting the loss landscape still benefits from higher LR at BATCH_SIZE=8. With fixed wall-clock budget, a higher LR allows faster parameter updates within the time constraint, reaching better minima.", "components": ["hyperparameter", "optimizer"], "fix_attempts": 0, "crash_kind": null, "budget_event": null}, "t": 1790341080.6292264, "seq": 10}
{"id": "exp_c60b5811b2", "parent": null, "round": 0, "kind": "baseline", "status": "keep", "score": 2.8288339009396535, "cost": 0.1, "change": "baseline", "artifact_id": "c3640d1810ba08961be266e3025f3f94b0bf06e7ee27a3ba2d400b7fff280d33", "diff": "", "metrics": {"memory_gb": 0.1, "wall_s": 8.589, "samples": [2.8288339009396535], "val_epoch": 0}, "meta": {"commit": "906744c", "program_version": "67a030e", "keep_rule": "strict", "mode": "hardened", "verdict": null, "verdict_details": null, "crash_reason": null, "summary": {"val_bpb": 2.828834, "training_seconds": 8.2, "total_seconds": 8.5, "peak_mem_mb": 80.3, "num_steps": 1389.0, "num_params_M": 0.05, "depth": 1.0}, "noise": {"delta": 0.025729782075366497, "sd_null": 0.012864891037683249, "z": 2.0, "mode": "repeat", "n": 4}, "noise_runs": [2.848039133521197, 2.838725401340871, 2.8293109526244846, 2.8288339009396535], "audit": {"test_iid": 2.879619476269963, "test_shift": 2.9514861549111173, "loop_metric_rerun": 2.820127363034176}}, "t": 1790340033.6830103, "seq": 0}
{"id": "exp_9b2d39b77e", "parent": "exp_c60b5811b2", "round": 3, "kind": "candidate", "status": "keep", "score": 2.7399703598292153, "cost": 0.1, "change": "Increase learning rate from 0.003 to 0.004 for faster convergence within fixed budget", "artifact_id": "ed7f614abfe3f7f2f187b3ff151f904ffb020341cb8c4949f81f8fabf714fd73", "diff": "--- a/train.py\n+++ b/train.py\n@@ -29,7 +29,7 @@\n BATCH_SIZE = 32          # rows per step\n TRAIN_SEQ_LEN = 16       # positions per row (examples per step = BATCH_SIZE * TRAIN_SEQ_LEN)\n OPTIMIZER = \"adam\"       # adam | sgd\n-LR = 0.003\n+LR = 0.004\n ADAM_BETAS = (0.9, 0.99)\n WEIGHT_DECAY = 0.0\n WARMUP_RATIO = 0.0\n", "metrics": {"memory_gb": 0.1, "wall_s": 8.549, "samples": [2.7399703598292153], "val_epoch": 0}, "meta": {"commit": "a285d1a", "program_version": "67a030e", "keep_rule": "strict", "mode": "hardened", "verdict": "gain +0.0889 > 0.0", "verdict_details": {"gain": 0.08886354111043815}, "crash_reason": null, "summary": {"val_bpb": 2.73997, "training_seconds": 8.2, "total_seconds": 8.4, "peak_mem_mb": 80.2, "num_steps": 1449.0, "num_params_M": 0.05, "depth": 1.0}, "edit_kind": null, "edit": null, "hypothesis": "With a fixed 8-second training budget, increasing the learning rate should enable faster optimization convergence. Previous larger model attempts failed, suggesting the baseline architecture is good but might benefit from LR tuning. A modest 33% LR increase may help the optimizer find better minima before time expires, similar to how fixed-budget experiments often favor higher learning rates.", "components": ["hyperparameter", "optimizer"], "fix_attempts": 0, "crash_kind": null, "budget_event": null, "audit": {"test_iid": 2.8125654710869408, "test_shift": 2.8757209619703863, "loop_metric_rerun": 2.753486039488761}}, "t": 1790340353.7695012, "seq": 3}
