{"id": "exp_c26bd08fb5", "parent": "exp_9b2d39b77e", "round": 4, "kind": "candidate", "status": "keep", "score": 2.6973124314861963, "cost": 0.1, "change": "Increase learning rate from 0.004 to 0.005 to further accelerate convergence", "artifact_id": "fda210b667d715345ac4e1d795b1c80c9938663688623da958a5838c17285903", "diff": "--- a/train.py\n+++ b/train.py\n@@ -29,7 +29,7 @@\n BATCH_SIZE = 32          # rows per step\n TRAIN_SEQ_LEN = 16       # positions per row (examples per step = BATCH_SIZE * TRAIN_SEQ_LEN)\n OPTIMIZER = \"adam\"       # adam | sgd\n-LR = 0.004\n+LR = 0.005\n ADAM_BETAS = (0.9, 0.99)\n WEIGHT_DECAY = 0.0\n WARMUP_RATIO = 0.0\n", "metrics": {"memory_gb": 0.1, "wall_s": 8.585, "samples": [2.6973124314861963], "val_epoch": 0}, "meta": {"commit": "533edda", "program_version": "67a030e", "keep_rule": "strict", "mode": "hardened", "verdict": "gain +0.0427 > 0.0", "verdict_details": {"gain": 0.04265792834301907}, "crash_reason": null, "summary": {"val_bpb": 2.697312, "training_seconds": 8.2, "total_seconds": 8.5, "peak_mem_mb": 81.5, "num_steps": 1426.0, "num_params_M": 0.05, "depth": 1.0}, "edit_kind": null, "edit": null, "hypothesis": "The previous LR increase from 0.003\u21920.004 improved val_bpb by ~0.09, suggesting we remain in the regime where higher learning rates help. A 25% increase to 0.005 should continue this trend within a fixed training budget where optimization is the bottleneck, not model capacity.", "components": ["hyperparameter", "optimizer"], "fix_attempts": 0, "crash_kind": null, "budget_event": null, "audit": {"test_iid": 2.7554745538620558, "test_shift": 2.815005873859263, "loop_metric_rerun": 2.6946792608095196}}, "t": 1790340471.5455554, "seq": 4}
{"id": "exp_7eafa6ddef", "parent": "exp_c26bd08fb5", "round": 6, "kind": "candidate", "status": "keep", "score": 2.666246678023838, "cost": 0.1, "change": "Reduce BATCH_SIZE from 32 to 16 to double training steps and data coverage within fixed budget", "artifact_id": "f6a383da5585c9371fe57a0279f60f4e4aaf6d4a11fa51d7dcdd2be2a9401e08", "diff": "--- a/train.py\n+++ b/train.py\n@@ -26,7 +26,7 @@\n HIDDEN = 128             # width of each hidden layer\n DEPTH = 1                # number of hidden layers\n ACTIVATION = \"tanh\"      # tanh | relu\n-BATCH_SIZE = 32          # rows per step\n+BATCH_SIZE = 16          # rows per step\n TRAIN_SEQ_LEN = 16       # positions per row (examples per step = BATCH_SIZE * TRAIN_SEQ_LEN)\n OPTIMIZER = \"adam\"       # adam | sgd\n LR = 0.005\n", "metrics": {"memory_gb": 0.1, "wall_s": 8.581, "samples": [2.666246678023838], "val_epoch": 0}, "meta": {"commit": "83d320f", "program_version": "67a030e", "keep_rule": "strict", "mode": "hardened", "verdict": "gain +0.0311 > 0.0", "verdict_details": {"gain": 0.03106575346235818}, "crash_reason": null, "summary": {"val_bpb": 2.666247, "training_seconds": 8.2, "total_seconds": 8.5, "peak_mem_mb": 79.3, "num_steps": 2484.0, "num_params_M": 0.05, "depth": 1.0}, "edit_kind": null, "edit": null, "hypothesis": "With a fixed 8-second budget and small, fixed training corpus, increasing the number of gradient updates (by halving batch size) should allow the model to see more training data iterations and converge better. Smaller batches with more frequent updates often outperform fewer large-batch updates when training time is constrained, even with noisier gradients.", "components": ["hyperparameters"], "fix_attempts": 0, "crash_kind": null, "budget_event": null, "audit": {"test_iid": 2.723226297149213, "test_shift": 2.778373564904901, "loop_metric_rerun": 2.662539453234716}}, "t": 1790340689.9150743, "seq": 6}
{"id": "exp_4665b54153", "parent": "exp_7eafa6ddef", "round": 7, "kind": "candidate", "status": "keep", "score": 2.6561396570905105, "cost": 0.1, "change": "Reduce BATCH_SIZE from 16 to 8 to enable more gradient steps within fixed budget", "artifact_id": "15fd2553001ef32f18051aa8f92f037dd8d22bce9700a1cf604245e50d56dd8b", "diff": "--- a/train.py\n+++ b/train.py\n@@ -26,7 +26,7 @@\n HIDDEN = 128             # width of each hidden layer\n DEPTH = 1                # number of hidden layers\n ACTIVATION = \"tanh\"      # tanh | relu\n-BATCH_SIZE = 16          # rows per step\n+BATCH_SIZE = 8           # rows per step\n TRAIN_SEQ_LEN = 16       # positions per row (examples per step = BATCH_SIZE * TRAIN_SEQ_LEN)\n OPTIMIZER = \"adam\"       # adam | sgd\n LR = 0.005\n", "metrics": {"memory_gb": 0.1, "wall_s": 8.726, "samples": [2.6561396570905105], "val_epoch": 0}, "meta": {"commit": "197ab6b", "program_version": "67a030e", "keep_rule": "strict", "mode": "hardened", "verdict": "gain +0.0101 > 0.0", "verdict_details": {"gain": 0.010107020933327604}, "crash_reason": null, "summary": {"val_bpb": 2.65614, "training_seconds": 8.2, "total_seconds": 8.6, "peak_mem_mb": 77.8, "num_steps": 4314.0, "num_params_M": 0.05, "depth": 1.0}, "edit_kind": null, "edit": null, "hypothesis": "Smaller batches provide more frequent parameter updates (2x more steps) and implicit regularization. The previous reduction 32\u219216 improved val_bpb by 0.031; continuing this trend should further improve convergence on the fixed budget. More steps may overcome any increase in gradient noise via Adam's adaptive learning rates.", "components": ["hyperparameter", "training_loop"], "fix_attempts": 0, "crash_kind": null, "budget_event": null, "audit": {"test_iid": 2.7193235906110775, "test_shift": 2.7901903389793743, "loop_metric_rerun": 2.6535389872134734}}, "t": 1790340780.067334, "seq": 7}
{"id": "exp_d1030218da", "parent": "exp_4665b54153", "round": 9, "kind": "candidate", "status": "keep", "score": 2.6308254050878395, "cost": 0.1, "change": "Increase learning rate from 0.005 to 0.006 to further accelerate convergence", "artifact_id": "12ca9fd903bd78c715497c942b7a4bebdb3edfcb6ff6a3507aa1def7fd0b6c3d", "diff": "--- a/train.py\n+++ b/train.py\n@@ -29,7 +29,7 @@\n BATCH_SIZE = 8           # rows per step\n TRAIN_SEQ_LEN = 16       # positions per row (examples per step = BATCH_SIZE * TRAIN_SEQ_LEN)\n OPTIMIZER = \"adam\"       # adam | sgd\n-LR = 0.005\n+LR = 0.006\n ADAM_BETAS = (0.9, 0.99)\n WEIGHT_DECAY = 0.0\n WARMUP_RATIO = 0.0\n", "metrics": {"memory_gb": 0.1, "wall_s": 8.729, "samples": [2.6308254050878395], "val_epoch": 0}, "meta": {"commit": "020a551", "program_version": "67a030e", "keep_rule": "strict", "mode": "hardened", "verdict": "gain +0.0253 > 0.0", "verdict_details": {"gain": 0.02531425200267101}, "crash_reason": null, "summary": {"val_bpb": 2.630825, "training_seconds": 8.2, "total_seconds": 8.6, "peak_mem_mb": 77.4, "num_steps": 4412.0, "num_params_M": 0.05, "depth": 1.0}, "edit_kind": null, "edit": null, "hypothesis": "The sequence of LR increases (0.003 \u2192 0.004 \u2192 0.005) has consistently improved val_bpb with diminishing but still positive returns. Given that batch size tuning is saturating (4 was worse), the learning rate remains a promising axis. Pushing to 0.006 may find a better convergence point within the fixed budget, allowing more effective parameter updates in the early-to-mid phase of training before the warmdown schedule kicks in.", "components": ["hyperparameters"], "fix_attempts": 0, "crash_kind": null, "budget_event": null, "audit": {"test_iid": 2.7130467432067693, "test_shift": 2.7738509142833383, "loop_metric_rerun": 2.638214862057464}}, "t": 1790340985.9963934, "seq": 9}
{"id": "exp_920eda8b93", "parent": "exp_d1030218da", "round": 10, "kind": "candidate", "status": "keep", "score": 2.622188131367283, "cost": 0.1, "change": "Increase learning rate from 0.006 to 0.007 to further accelerate convergence", "artifact_id": "1fff31e8228a0ac5fa34554e8d6d1569198c9d29cf20584796150822e5b5f81b", "diff": "--- a/train.py\n+++ b/train.py\n@@ -29,7 +29,7 @@\n BATCH_SIZE = 8           # rows per step\n TRAIN_SEQ_LEN = 16       # positions per row (examples per step = BATCH_SIZE * TRAIN_SEQ_LEN)\n OPTIMIZER = \"adam\"       # adam | sgd\n-LR = 0.006\n+LR = 0.007\n ADAM_BETAS = (0.9, 0.99)\n WEIGHT_DECAY = 0.0\n WARMUP_RATIO = 0.0\n", "metrics": {"memory_gb": 0.1, "wall_s": 8.653, "samples": [2.622188131367283], "val_epoch": 0}, "meta": {"commit": "363363c", "program_version": "67a030e", "keep_rule": "strict", "mode": "hardened", "verdict": "gain +0.0086 > 0.0", "verdict_details": {"gain": 0.00863727372055667}, "crash_reason": null, "summary": {"val_bpb": 2.622188, "training_seconds": 8.2, "total_seconds": 8.6, "peak_mem_mb": 77.4, "num_steps": 4430.0, "num_params_M": 0.05, "depth": 1.0}, "edit_kind": null, "edit": null, "hypothesis": "The learning rate trend shows consistent improvement: 0.003\u21920.004 (+0.088), 0.004\u21920.005 (+0.043), 0.005\u21920.006 (+0.066). The last jump was substantial, suggesting the loss landscape still benefits from higher LR at BATCH_SIZE=8. With fixed wall-clock budget, a higher LR allows faster parameter updates within the time constraint, reaching better minima.", "components": ["hyperparameter", "optimizer"], "fix_attempts": 0, "crash_kind": null, "budget_event": null, "audit": {"test_iid": 2.689511852574486, "test_shift": 2.7864708230022615, "loop_metric_rerun": 2.6245784176820237}}, "t": 1790341080.6292264, "seq": 10}
