{"id": "exp_ec606069d7", "parent": "exp_9b35402a94", "round": 3, "kind": "candidate", "status": "keep", "score": 2.6478326649002915, "cost": 0.077, "change": "Increase learning rate from 0.01 to 0.02", "artifact_id": "b38ebaf7c8e780dd7f03f0f19dd88f2e301c460c3884cd0dc9a52bc96dad6f01", "diff": "--- a/train.py\n+++ b/train.py\n@@ -29,7 +29,7 @@\n BATCH_SIZE = 32          # rows per step\n TRAIN_SEQ_LEN = 16       # positions per row (examples per step = BATCH_SIZE * TRAIN_SEQ_LEN)\n OPTIMIZER = \"adam\"       # adam | sgd\n-LR = 0.01\n+LR = 0.02\n ADAM_BETAS = (0.9, 0.99)\n WEIGHT_DECAY = 0.0\n WARMUP_RATIO = 0.0\n", "metrics": {"memory_gb": 0.077, "wall_s": 8.619, "samples": [2.6478326649002915], "val_epoch": 0}, "meta": {"commit": "d137e15", "program_version": "67fe238", "keep_rule": "strict", "mode": "hardened", "verdict": "gain +0.0344 > 0.0", "verdict_details": {"gain": 0.03435565300808685}, "crash_reason": null, "summary": {"val_bpb": 2.647833, "training_seconds": 8.0, "total_seconds": 8.5, "peak_vram_mb": 78.5, "mfu_percent": 17.41, "total_tokens_M": 0.516, "num_steps": 1008.0, "num_params_M": 0.05, "depth": 1.0}, "edit_kind": null, "edit": null, "hypothesis": "The substantial improvement from LR=0.003\u21920.01 (0.273 bpb gain) indicates learning rate was the main bottleneck. A further increase to 0.02 should improve convergence speed and final performance. The improvement may be smaller due to diminishing returns, but the trend strongly justifies exploration.", "components": ["hyperparameters"], "fix_attempts": 0, "crash_kind": null, "budget_event": null, "audit": {"test_iid": 2.7252344370858723, "test_shift": 2.780168266765907, "loop_metric_rerun": 2.648103411355713}}, "t": 1790753951.831525, "seq": 3}
{"id": "exp_e6a66fdcdd", "parent": "exp_ec606069d7", "round": 4, "kind": "candidate", "status": "keep", "score": 2.636878979180558, "cost": 0.089, "change": "Increase HIDDEN layer width from 128 to 256", "artifact_id": "ced1d19c56ee066680a974224baa8444c9a7035593ae968dac44fbd270784f5c", "diff": "--- a/train.py\n+++ b/train.py\n@@ -23,7 +23,7 @@\n # ---------------------------------------------------------------------------\n CONTEXT = 6              # bytes of history the model sees\n EMBED_DIM = 16           # byte embedding size\n-HIDDEN = 128             # width of each hidden layer\n+HIDDEN = 256             # width of each hidden layer\n DEPTH = 1                # number of hidden layers\n ACTIVATION = \"tanh\"      # tanh | relu\n BATCH_SIZE = 32          # rows per step\n", "metrics": {"memory_gb": 0.089, "wall_s": 8.903, "samples": [2.636878979180558], "val_epoch": 0}, "meta": {"commit": "931edb4", "program_version": "67fe238", "keep_rule": "strict", "mode": "hardened", "verdict": "gain +0.0110 > 0.0", "verdict_details": {"gain": 0.010953685719733652}, "crash_reason": null, "summary": {"val_bpb": 2.636879, "training_seconds": 8.0, "total_seconds": 8.8, "peak_vram_mb": 90.9, "mfu_percent": 20.07, "total_tokens_M": 0.301, "num_steps": 588.0, "num_params_M": 0.095, "depth": 1.0}, "edit_kind": null, "edit": null, "hypothesis": "The current model (50K params, DEPTH=1) is quite small. Increasing hidden capacity should allow better function approximation within the fixed time budget. Unlike the failed CONTEXT experiment which increased input dimension, this increases representational capacity without changing the input size, making it a safer scaling direction. Memory headroom is substantial (0.077 GB current).", "components": ["architecture"], "fix_attempts": 0, "crash_kind": null, "budget_event": null, "audit": {"test_iid": 2.7336332084559793, "test_shift": 2.8456890024969077, "loop_metric_rerun": 2.6635444672475126}}, "t": 1790754062.9912493, "seq": 4}
