{"id": "exp_e5fa0fa4ca", "parent": null, "round": 0, "kind": "baseline", "status": "keep", "score": 2.9556875035032344, "cost": 0.078, "change": "baseline", "artifact_id": "cc879a1f6f29e289940eff06e8aca7155d0f34b930bb71654871c4cb71a0dac9", "diff": "", "metrics": {"memory_gb": 0.078, "wall_s": 9.559, "samples": [2.9556875035032344], "val_epoch": 0}, "meta": {"commit": "fa8b780", "program_version": "67fe238", "keep_rule": "strict", "mode": "hardened", "verdict": null, "verdict_details": null, "crash_reason": null, "summary": {"val_bpb": 2.955688, "training_seconds": 8.0, "total_seconds": 9.3, "peak_vram_mb": 79.5, "mfu_percent": 17.21, "total_tokens_M": 0.51, "num_steps": 997.0, "num_params_M": 0.05, "depth": 1.0}}, "t": 1790753634.2946537, "seq": 0}
{"id": "exp_243187a027", "parent": "exp_e5fa0fa4ca", "round": 1, "kind": "candidate", "status": "discard", "score": 3.0691515055496796, "cost": 0.077, "change": "Increase CONTEXT from 6 to 8 bytes", "artifact_id": "fd88dd7e3d24b1f1803b36188c36e6ef45b2e530a45f731034d69922bb002761", "diff": "--- a/train.py\n+++ b/train.py\n@@ -21,7 +21,7 @@\n # ---------------------------------------------------------------------------\n # Hyperparameters (edit these)\n # ---------------------------------------------------------------------------\n-CONTEXT = 6              # bytes of history the model sees\n+CONTEXT = 8              # bytes of history the model sees\n EMBED_DIM = 16           # byte embedding size\n HIDDEN = 128             # width of each hidden layer\n DEPTH = 1                # number of hidden layers\n", "metrics": {"memory_gb": 0.077, "wall_s": 8.619, "samples": [3.0691515055496796], "val_epoch": 0}, "meta": {"commit": "e62a984", "program_version": "67fe238", "keep_rule": "strict", "mode": "hardened", "verdict": "gain -0.1135 <= 0.0", "verdict_details": {"gain": -0.11346400204644524}, "crash_reason": null, "summary": {"val_bpb": 3.069152, "training_seconds": 8.0, "total_seconds": 8.5, "peak_vram_mb": 79.2, "mfu_percent": 15.08, "total_tokens_M": 0.411, "num_steps": 803.0, "num_params_M": 0.054, "depth": 1.0}, "edit_kind": null, "edit": null, "hypothesis": "Byte-level prediction benefits from longer context windows. 8 bytes of history (approximately 1.5-2 words) provides better information for predicting the next byte than 6 bytes, allowing the model to learn longer-range dependencies and word structure patterns. The added parameters (8% increase) should be easily absorbed within the fixed 8-second budget, trading fewer gradient steps for higher-quality learning signal.", "components": ["model_hyperparameters", "context_window"], "fix_attempts": 0, "crash_kind": null, "budget_event": null}, "t": 1790753754.3161826, "seq": 1}
{"id": "exp_9b35402a94", "parent": "exp_e5fa0fa4ca", "round": 2, "kind": "candidate", "status": "keep", "score": 2.6821883179083783, "cost": 0.077, "change": "Increase learning rate from 0.003 to 0.01", "artifact_id": "9ac9bd347df8bdd35174773ed6ef7d3d904dd07a92a3fe4e5dcfe5b31fe66d9b", "diff": "--- a/train.py\n+++ b/train.py\n@@ -29,7 +29,7 @@\n BATCH_SIZE = 32          # rows per step\n TRAIN_SEQ_LEN = 16       # positions per row (examples per step = BATCH_SIZE * TRAIN_SEQ_LEN)\n OPTIMIZER = \"adam\"       # adam | sgd\n-LR = 0.003\n+LR = 0.01\n ADAM_BETAS = (0.9, 0.99)\n WEIGHT_DECAY = 0.0\n WARMUP_RATIO = 0.0\n", "metrics": {"memory_gb": 0.077, "wall_s": 8.691, "samples": [2.6821883179083783], "val_epoch": 0}, "meta": {"commit": "3f4f61a", "program_version": "67fe238", "keep_rule": "strict", "mode": "hardened", "verdict": "gain +0.2735 > 0.0", "verdict_details": {"gain": 0.2734991855948561}, "crash_reason": null, "summary": {"val_bpb": 2.682188, "training_seconds": 8.0, "total_seconds": 8.6, "peak_vram_mb": 78.6, "mfu_percent": 16.99, "total_tokens_M": 0.504, "num_steps": 984.0, "num_params_M": 0.05, "depth": 1.0}, "edit_kind": null, "edit": null, "hypothesis": "The baseline LR appears conservative for this small model size. A 3.3x increase should accelerate convergence and allow the model to find a better optimum within the fixed training budget, especially since the architecture appears stable (no NaN losses).", "components": ["hyperparameter", "optimizer"], "fix_attempts": 0, "crash_kind": null, "budget_event": null}, "t": 1790753840.068321, "seq": 2}
{"id": "exp_ec606069d7", "parent": "exp_9b35402a94", "round": 3, "kind": "candidate", "status": "keep", "score": 2.6478326649002915, "cost": 0.077, "change": "Increase learning rate from 0.01 to 0.02", "artifact_id": "b38ebaf7c8e780dd7f03f0f19dd88f2e301c460c3884cd0dc9a52bc96dad6f01", "diff": "--- a/train.py\n+++ b/train.py\n@@ -29,7 +29,7 @@\n BATCH_SIZE = 32          # rows per step\n TRAIN_SEQ_LEN = 16       # positions per row (examples per step = BATCH_SIZE * TRAIN_SEQ_LEN)\n OPTIMIZER = \"adam\"       # adam | sgd\n-LR = 0.01\n+LR = 0.02\n ADAM_BETAS = (0.9, 0.99)\n WEIGHT_DECAY = 0.0\n WARMUP_RATIO = 0.0\n", "metrics": {"memory_gb": 0.077, "wall_s": 8.619, "samples": [2.6478326649002915], "val_epoch": 0}, "meta": {"commit": "d137e15", "program_version": "67fe238", "keep_rule": "strict", "mode": "hardened", "verdict": "gain +0.0344 > 0.0", "verdict_details": {"gain": 0.03435565300808685}, "crash_reason": null, "summary": {"val_bpb": 2.647833, "training_seconds": 8.0, "total_seconds": 8.5, "peak_vram_mb": 78.5, "mfu_percent": 17.41, "total_tokens_M": 0.516, "num_steps": 1008.0, "num_params_M": 0.05, "depth": 1.0}, "edit_kind": null, "edit": null, "hypothesis": "The substantial improvement from LR=0.003\u21920.01 (0.273 bpb gain) indicates learning rate was the main bottleneck. A further increase to 0.02 should improve convergence speed and final performance. The improvement may be smaller due to diminishing returns, but the trend strongly justifies exploration.", "components": ["hyperparameters"], "fix_attempts": 0, "crash_kind": null, "budget_event": null}, "t": 1790753951.831525, "seq": 3}
{"id": "exp_e6a66fdcdd", "parent": "exp_ec606069d7", "round": 4, "kind": "candidate", "status": "keep", "score": 2.636878979180558, "cost": 0.089, "change": "Increase HIDDEN layer width from 128 to 256", "artifact_id": "ced1d19c56ee066680a974224baa8444c9a7035593ae968dac44fbd270784f5c", "diff": "--- a/train.py\n+++ b/train.py\n@@ -23,7 +23,7 @@\n # ---------------------------------------------------------------------------\n CONTEXT = 6              # bytes of history the model sees\n EMBED_DIM = 16           # byte embedding size\n-HIDDEN = 128             # width of each hidden layer\n+HIDDEN = 256             # width of each hidden layer\n DEPTH = 1                # number of hidden layers\n ACTIVATION = \"tanh\"      # tanh | relu\n BATCH_SIZE = 32          # rows per step\n", "metrics": {"memory_gb": 0.089, "wall_s": 8.903, "samples": [2.636878979180558], "val_epoch": 0}, "meta": {"commit": "931edb4", "program_version": "67fe238", "keep_rule": "strict", "mode": "hardened", "verdict": "gain +0.0110 > 0.0", "verdict_details": {"gain": 0.010953685719733652}, "crash_reason": null, "summary": {"val_bpb": 2.636879, "training_seconds": 8.0, "total_seconds": 8.8, "peak_vram_mb": 90.9, "mfu_percent": 20.07, "total_tokens_M": 0.301, "num_steps": 588.0, "num_params_M": 0.095, "depth": 1.0}, "edit_kind": null, "edit": null, "hypothesis": "The current model (50K params, DEPTH=1) is quite small. Increasing hidden capacity should allow better function approximation within the fixed time budget. Unlike the failed CONTEXT experiment which increased input dimension, this increases representational capacity without changing the input size, making it a safer scaling direction. Memory headroom is substantial (0.077 GB current).", "components": ["architecture"], "fix_attempts": 0, "crash_kind": null, "budget_event": null}, "t": 1790754062.9912493, "seq": 4}
{"id": "exp_57de6f4684", "parent": "exp_e6a66fdcdd", "round": 5, "kind": "candidate", "status": "discard", "score": 2.697716152368591, "cost": 0.091, "change": "Add second hidden layer (DEPTH 1\u21922, HIDDEN 256\u2192160) to increase expressivity", "artifact_id": "31f9dd5376298e1c9515863a7396402247b089f21d45d070f8028892693d5ed4", "diff": "--- a/train.py\n+++ b/train.py\n@@ -23,8 +23,8 @@\n # ---------------------------------------------------------------------------\n CONTEXT = 6              # bytes of history the model sees\n EMBED_DIM = 16           # byte embedding size\n-HIDDEN = 256             # width of each hidden layer\n-DEPTH = 1                # number of hidden layers\n+HIDDEN = 160             # width of each hidden layer\n+DEPTH = 2                # number of hidden layers\n ACTIVATION = \"tanh\"      # tanh | relu\n BATCH_SIZE = 32          # rows per step\n TRAIN_SEQ_LEN = 16       # positions per row (examples per step = BATCH_SIZE * TRAIN_SEQ_LEN)\n", "metrics": {"memory_gb": 0.091, "wall_s": 8.931, "samples": [2.697716152368591], "val_epoch": 0}, "meta": {"commit": "413c7ca", "program_version": "67fe238", "keep_rule": "strict", "mode": "hardened", "verdict": "gain -0.0608 <= 0.0", "verdict_details": {"gain": -0.060837173188033056}, "crash_reason": null, "summary": {"val_bpb": 2.697716, "training_seconds": 8.0, "total_seconds": 8.8, "peak_vram_mb": 93.1, "mfu_percent": 17.89, "total_tokens_M": 0.294, "num_steps": 575.0, "num_params_M": 0.087, "depth": 2.0}, "edit_kind": null, "edit": null, "hypothesis": "Depth enables learning more complex patterns while keeping parameter count similar (~86k params vs ~95k currently), avoiding the computational overhead that hurt CONTEXT expansion. One additional hidden layer should improve the model's capacity to capture byte-level patterns in the fixed budget.", "components": ["model architecture"], "fix_attempts": 0, "crash_kind": null, "budget_event": null}, "t": 1790754197.420023, "seq": 5}
{"id": "exp_f3df0274da", "parent": "exp_e6a66fdcdd", "round": 6, "kind": "candidate", "status": "discard", "score": 2.6722876295534714, "cost": 0.089, "change": "Increase EMBED_DIM from 16 to 24", "artifact_id": "7497e582d20bdac39443fd9d9e1870024e0247383601d60aa31cb89a8d26be5e", "diff": "--- a/train.py\n+++ b/train.py\n@@ -22,7 +22,7 @@\n # Hyperparameters (edit these)\n # ---------------------------------------------------------------------------\n CONTEXT = 6              # bytes of history the model sees\n-EMBED_DIM = 16           # byte embedding size\n+EMBED_DIM = 24           # byte embedding size\n HIDDEN = 256             # width of each hidden layer\n DEPTH = 1                # number of hidden layers\n ACTIVATION = \"tanh\"      # tanh | relu\n", "metrics": {"memory_gb": 0.089, "wall_s": 8.915, "samples": [2.6722876295534714], "val_epoch": 0}, "meta": {"commit": "4d5e646", "program_version": "67fe238", "keep_rule": "strict", "mode": "hardened", "verdict": "gain -0.0354 <= 0.0", "verdict_details": {"gain": -0.03540865037291363}, "crash_reason": null, "summary": {"val_bpb": 2.672288, "training_seconds": 8.0, "total_seconds": 8.8, "peak_vram_mb": 90.8, "mfu_percent": 18.86, "total_tokens_M": 0.25, "num_steps": 488.0, "num_params_M": 0.109, "depth": 1.0}, "edit_kind": null, "edit": null, "hypothesis": "Richer byte embeddings (24 dims instead of 16) will allow the model to learn more nuanced byte representations while staying within memory constraints. The embedding layer is the primary bottleneck for representation capacity in this MLP architecture, and increasing EMBED_DIM directly expands expressiveness without adding layers (which previously hurt performance).", "components": ["embeddings", "model_capacity"], "fix_attempts": 0, "crash_kind": null, "budget_event": null}, "t": 1790754289.7335415, "seq": 6}
{"id": "exp_d47734b253", "parent": "exp_e6a66fdcdd", "round": 7, "kind": "candidate", "status": "discard", "score": 2.68537201208306, "cost": 0.088, "change": "Add L2 regularization (weight_decay=0.0001) for better generalization with larger model", "artifact_id": "08336520d98ab04489d21f7a85a759e7c380bbbc07782d73a2327bba63b483fc", "diff": "--- a/train.py\n+++ b/train.py\n@@ -31,7 +31,7 @@\n OPTIMIZER = \"adam\"       # adam | sgd\n LR = 0.02\n ADAM_BETAS = (0.9, 0.99)\n-WEIGHT_DECAY = 0.0\n+WEIGHT_DECAY = 0.0001\n WARMUP_RATIO = 0.0\n WARMDOWN_RATIO = 0.5\n FINAL_LR_FRAC = 0.0\n", "metrics": {"memory_gb": 0.088, "wall_s": 8.79, "samples": [2.68537201208306], "val_epoch": 0}, "meta": {"commit": "9ef1865", "program_version": "67fe238", "keep_rule": "strict", "mode": "hardened", "verdict": "gain -0.0485 <= 0.0", "verdict_details": {"gain": -0.048493032902502176}, "crash_reason": null, "summary": {"val_bpb": 2.685372, "training_seconds": 8.0, "total_seconds": 8.7, "peak_vram_mb": 89.9, "mfu_percent": 16.76, "total_tokens_M": 0.252, "num_steps": 492.0, "num_params_M": 0.095, "depth": 1.0}, "edit_kind": null, "edit": null, "hypothesis": "The current best model (HIDDEN=256) is significantly larger than the baseline. Regularization via weight decay should help it generalize better to unseen validation data by penalizing large weights, similar to how deeper/wider architectures benefited from better optimization. Weight decay is a standard technique and conservative value (0.0001) is unlikely to hurt.", "components": ["hyperparameter", "regularization"], "fix_attempts": 0, "crash_kind": null, "budget_event": null}, "t": 1790754360.8251576, "seq": 7}
{"id": "exp_7c8a186657", "parent": "exp_e6a66fdcdd", "round": 8, "kind": "candidate", "status": "discard", "score": 3.1007389117553097, "cost": 0.088, "change": "Remove learning rate warmdown schedule (keep LR constant)", "artifact_id": "e8254ce648c8ee9a6a48dc0e3abb43c2e0a6d6b802e184ca2616749c511ddc95", "diff": "--- a/train.py\n+++ b/train.py\n@@ -33,7 +33,7 @@\n ADAM_BETAS = (0.9, 0.99)\n WEIGHT_DECAY = 0.0\n WARMUP_RATIO = 0.0\n-WARMDOWN_RATIO = 0.5\n+WARMDOWN_RATIO = 0.0\n FINAL_LR_FRAC = 0.0\n INIT_SCALE = 1.0\n EVAL_BATCH_SIZE = 64\n", "metrics": {"memory_gb": 0.088, "wall_s": 8.889, "samples": [3.1007389117553097], "val_epoch": 0}, "meta": {"commit": "67068b5", "program_version": "67fe238", "keep_rule": "strict", "mode": "hardened", "verdict": "gain -0.4639 <= 0.0", "verdict_details": {"gain": -0.4638599325747519}, "crash_reason": null, "summary": {"val_bpb": 3.100739, "training_seconds": 8.0, "total_seconds": 8.8, "peak_vram_mb": 90.4, "mfu_percent": 19.2, "total_tokens_M": 0.288, "num_steps": 562.0, "num_params_M": 0.095, "depth": 1.0}, "edit_kind": null, "edit": null, "hypothesis": "The current warmdown schedule (WARMDOWN_RATIO=0.5) decays LR from 0.02 to 0 over the second half of the 8-second budget, wasting the latter part of training. With a fixed short budget, a constant LR throughout should allow better optimization. The lack of warmup suggests annealing to zero is unnecessarily aggressive.", "components": ["hyperparameter", "training_loop"], "fix_attempts": 0, "crash_kind": null, "budget_event": null}, "t": 1790754461.3564978, "seq": 8}
{"id": "exp_ba2db64797", "parent": "exp_e6a66fdcdd", "round": 9, "kind": "candidate", "status": "discard", "score": 2.689674999416948, "cost": 0.089, "change": "Increase training time at full LR by reducing warmdown onset (WARMDOWN_RATIO 0.5\u21920.33)", "artifact_id": "ad06f97e7c5a3cbe4a2fa006834726cc3f01da6fc1fecc8f4849f5337c2b48be", "diff": "--- a/train.py\n+++ b/train.py\n@@ -33,7 +33,7 @@\n ADAM_BETAS = (0.9, 0.99)\n WEIGHT_DECAY = 0.0\n WARMUP_RATIO = 0.0\n-WARMDOWN_RATIO = 0.5\n+WARMDOWN_RATIO = 0.33\n FINAL_LR_FRAC = 0.0\n INIT_SCALE = 1.0\n EVAL_BATCH_SIZE = 64\n", "metrics": {"memory_gb": 0.089, "wall_s": 8.804, "samples": [2.689674999416948], "val_epoch": 0}, "meta": {"commit": "2733c4c", "program_version": "67fe238", "keep_rule": "strict", "mode": "hardened", "verdict": "gain -0.0528 <= 0.0", "verdict_details": {"gain": -0.052796020236390184}, "crash_reason": null, "summary": {"val_bpb": 2.689675, "training_seconds": 8.0, "total_seconds": 8.7, "peak_vram_mb": 91.0, "mfu_percent": 18.72, "total_tokens_M": 0.281, "num_steps": 548.0, "num_params_M": 0.095, "depth": 1.0}, "edit_kind": null, "edit": null, "hypothesis": "The current schedule spends only 50% of training at full LR before linearly decaying to 0. Keeping full LR for 67% of training (until progress=0.67) before decay should allow more learning during the budget-constrained training window. Completely removing warmdown was catastrophic (3.1 BPB), so some decay is needed, but delaying it should help convergence.", "components": ["hyperparameter", "learning_rate_schedule"], "fix_attempts": 0, "crash_kind": null, "budget_event": null}, "t": 1790754556.6442916, "seq": 9}
{"id": "exp_a8a7ae91ae", "parent": "exp_e6a66fdcdd", "round": 10, "kind": "candidate", "status": "discard", "score": 3.836316686916548, "cost": 0.09, "change": "Switch optimizer from Adam to SGD with momentum", "artifact_id": "92b2319e7186dcd105ebd964ff92a44af88da70d281c9d2848e4869492c3d167", "diff": "--- a/train.py\n+++ b/train.py\n@@ -28,7 +28,7 @@\n ACTIVATION = \"tanh\"      # tanh | relu\n BATCH_SIZE = 32          # rows per step\n TRAIN_SEQ_LEN = 16       # positions per row (examples per step = BATCH_SIZE * TRAIN_SEQ_LEN)\n-OPTIMIZER = \"adam\"       # adam | sgd\n+OPTIMIZER = \"sgd\"        # adam | sgd\n LR = 0.02\n ADAM_BETAS = (0.9, 0.99)\n WEIGHT_DECAY = 0.0\n", "metrics": {"memory_gb": 0.09, "wall_s": 8.891, "samples": [3.836316686916548], "val_epoch": 0}, "meta": {"commit": "f3fddc3", "program_version": "67fe238", "keep_rule": "strict", "mode": "hardened", "verdict": "gain -1.1994 <= 0.0", "verdict_details": {"gain": -1.1994377077359903}, "crash_reason": null, "summary": {"val_bpb": 3.836317, "training_seconds": 8.0, "total_seconds": 8.8, "peak_vram_mb": 92.5, "mfu_percent": 19.9, "total_tokens_M": 0.298, "num_steps": 582.0, "num_params_M": 0.095, "depth": 1.0}, "edit_kind": null, "edit": null, "hypothesis": "SGD with momentum often generalizes better than Adam and may achieve lower validation loss on the byte-level LM task. Adam's adaptive learning rates may be less optimal for this specific problem, whereas SGD's simpler momentum provides more stable convergence.", "components": ["optimizer", "training_loop"], "fix_attempts": 0, "crash_kind": null, "budget_event": null}, "t": 1790754663.494733, "seq": 10}
{"id": "exp_e5fa0fa4ca", "parent": null, "round": 0, "kind": "baseline", "status": "keep", "score": 2.9556875035032344, "cost": 0.078, "change": "baseline", "artifact_id": "cc879a1f6f29e289940eff06e8aca7155d0f34b930bb71654871c4cb71a0dac9", "diff": "", "metrics": {"memory_gb": 0.078, "wall_s": 9.559, "samples": [2.9556875035032344], "val_epoch": 0}, "meta": {"commit": "fa8b780", "program_version": "67fe238", "keep_rule": "strict", "mode": "hardened", "verdict": null, "verdict_details": null, "crash_reason": null, "summary": {"val_bpb": 2.955688, "training_seconds": 8.0, "total_seconds": 9.3, "peak_vram_mb": 79.5, "mfu_percent": 17.21, "total_tokens_M": 0.51, "num_steps": 997.0, "num_params_M": 0.05, "depth": 1.0}, "audit": {"test_iid": 3.0037504524192458, "test_shift": 3.0627687403286985, "loop_metric_rerun": 2.942976613240152}}, "t": 1790753634.2946537, "seq": 0}
{"id": "exp_9b35402a94", "parent": "exp_e5fa0fa4ca", "round": 2, "kind": "candidate", "status": "keep", "score": 2.6821883179083783, "cost": 0.077, "change": "Increase learning rate from 0.003 to 0.01", "artifact_id": "9ac9bd347df8bdd35174773ed6ef7d3d904dd07a92a3fe4e5dcfe5b31fe66d9b", "diff": "--- a/train.py\n+++ b/train.py\n@@ -29,7 +29,7 @@\n BATCH_SIZE = 32          # rows per step\n TRAIN_SEQ_LEN = 16       # positions per row (examples per step = BATCH_SIZE * TRAIN_SEQ_LEN)\n OPTIMIZER = \"adam\"       # adam | sgd\n-LR = 0.003\n+LR = 0.01\n ADAM_BETAS = (0.9, 0.99)\n WEIGHT_DECAY = 0.0\n WARMUP_RATIO = 0.0\n", "metrics": {"memory_gb": 0.077, "wall_s": 8.691, "samples": [2.6821883179083783], "val_epoch": 0}, "meta": {"commit": "3f4f61a", "program_version": "67fe238", "keep_rule": "strict", "mode": "hardened", "verdict": "gain +0.2735 > 0.0", "verdict_details": {"gain": 0.2734991855948561}, "crash_reason": null, "summary": {"val_bpb": 2.682188, "training_seconds": 8.0, "total_seconds": 8.6, "peak_vram_mb": 78.6, "mfu_percent": 16.99, "total_tokens_M": 0.504, "num_steps": 984.0, "num_params_M": 0.05, "depth": 1.0}, "edit_kind": null, "edit": null, "hypothesis": "The baseline LR appears conservative for this small model size. A 3.3x increase should accelerate convergence and allow the model to find a better optimum within the fixed training budget, especially since the architecture appears stable (no NaN losses).", "components": ["hyperparameter", "optimizer"], "fix_attempts": 0, "crash_kind": null, "budget_event": null, "audit": {"test_iid": 2.736233512869521, "test_shift": 2.8135314216764113, "loop_metric_rerun": 2.6761334570744886}}, "t": 1790753840.068321, "seq": 2}
