{"id": "exp_c6e6482276", "parent": null, "round": 0, "kind": "baseline", "status": "keep", "score": 2.829327388617751, "cost": 0.1, "change": "baseline", "artifact_id": "c3640d1810ba08961be266e3025f3f94b0bf06e7ee27a3ba2d400b7fff280d33", "diff": "", "metrics": {"memory_gb": 0.1, "wall_s": 8.461, "samples": [2.829327388617751], "val_epoch": 0}, "meta": {"commit": "906744c", "program_version": "67a030e", "keep_rule": "strict", "mode": "hardened", "verdict": null, "verdict_details": null, "crash_reason": null, "summary": {"val_bpb": 2.829327, "training_seconds": 8.1, "total_seconds": 8.4, "peak_mem_mb": 80.6, "num_steps": 1390.0, "num_params_M": 0.05, "depth": 1.0}}, "t": 1790334036.8973985, "seq": 0}
{"id": "exp_15eac0a963", "parent": "exp_c6e6482276", "round": 1, "kind": "candidate", "status": "discard", "score": 2.895547906220567, "cost": 0.1, "change": "Increase CONTEXT 6\u219210 and DEPTH 1\u21922", "artifact_id": "ba92c926d733ccd84cf0d3e32cf8ef28a9b68d05d8c636464724ed6fb64a9419", "diff": "--- a/train.py\n+++ b/train.py\n@@ -21,10 +21,10 @@\n # ---------------------------------------------------------------------------\n # Hyperparameters (edit these)\n # ---------------------------------------------------------------------------\n-CONTEXT = 6              # bytes of history the model sees\n+CONTEXT = 10             # bytes of history the model sees\n EMBED_DIM = 16           # byte embedding size\n HIDDEN = 128             # width of each hidden layer\n-DEPTH = 1                # number of hidden layers\n+DEPTH = 2                # number of hidden layers\n ACTIVATION = \"tanh\"      # tanh | relu\n BATCH_SIZE = 32          # rows per step\n TRAIN_SEQ_LEN = 16       # positions per row (examples per step = BATCH_SIZE * TRAIN_SEQ_LEN)\n", "metrics": {"memory_gb": 0.1, "wall_s": 8.667, "samples": [2.895547906220567], "val_epoch": 0}, "meta": {"commit": "0abce28", "program_version": "67a030e", "keep_rule": "strict", "mode": "hardened", "verdict": "gain -0.0662 <= 0.0", "verdict_details": {"gain": -0.06622051760281611}, "crash_reason": null, "summary": {"val_bpb": 2.895548, "training_seconds": 8.2, "total_seconds": 8.6, "peak_mem_mb": 90.7, "num_steps": 888.0, "num_params_M": 0.074, "depth": 2.0}, "edit_kind": null, "edit": null, "hypothesis": "Deeper networks (2 hidden layers instead of 1) provide more model expressiveness for learning complex byte-level patterns. Longer context (10 instead of 6 bytes) allows the model to capture longer-range dependencies, which should improve generalization to unseen test data. The ~1.5x compute increase still leaves sufficient training steps within the budget.", "components": ["model_architecture", "hyperparameters"], "fix_attempts": 2, "crash_kind": null, "budget_event": null}, "t": 1790334229.2626214, "seq": 1}
{"id": "exp_2ce1f2e640", "parent": "exp_c6e6482276", "round": 2, "kind": "candidate", "status": "keep", "score": 2.7951487190905753, "cost": 0.1, "change": "Reduce BATCH_SIZE 32 -> 24", "artifact_id": "0094b1cca9fe55e16cec9fe8d0f0588b9279d9dbdee2fbfbb0cba32e16b48310", "diff": "--- a/train.py\n+++ b/train.py\n@@ -26,7 +26,7 @@\n HIDDEN = 128             # width of each hidden layer\n DEPTH = 1                # number of hidden layers\n ACTIVATION = \"tanh\"      # tanh | relu\n-BATCH_SIZE = 32          # rows per step\n+BATCH_SIZE = 24          # rows per step\n TRAIN_SEQ_LEN = 16       # positions per row (examples per step = BATCH_SIZE * TRAIN_SEQ_LEN)\n OPTIMIZER = \"adam\"       # adam | sgd\n LR = 0.003\n", "metrics": {"memory_gb": 0.1, "wall_s": 8.539, "samples": [2.7951487190905753], "val_epoch": 0}, "meta": {"commit": "568c10b", "program_version": "67a030e", "keep_rule": "strict", "mode": "hardened", "verdict": "gain +0.0342 > 0.0", "verdict_details": {"gain": 0.03417866952717574}, "crash_reason": null, "summary": {"val_bpb": 2.795149, "training_seconds": 8.1, "total_seconds": 8.4, "peak_mem_mb": 80.3, "num_steps": 1822.0, "num_params_M": 0.05, "depth": 1.0}, "edit_kind": null, "edit": null, "hypothesis": "With a fixed wall-clock time budget, smaller batch size enables ~33% more gradient update steps. This allows more thorough training convergence within the same 8-second budget, offsetting slightly noisier per-step gradients.", "components": ["optimizer", "hyperparameters"], "fix_attempts": 0, "crash_kind": null, "budget_event": null}, "t": 1790334314.0467677, "seq": 2}
{"id": "exp_6b42401c09", "parent": "exp_2ce1f2e640", "round": 3, "kind": "candidate", "status": "keep", "score": 2.776318710359747, "cost": 0.1, "change": "Reduce BATCH_SIZE 24 -> 20 for more training steps in fixed budget", "artifact_id": "bdb7099629231486828f6ca6e023e269388e6f9b7958a5e0e0118c939bafb072", "diff": "--- a/train.py\n+++ b/train.py\n@@ -26,7 +26,7 @@\n HIDDEN = 128             # width of each hidden layer\n DEPTH = 1                # number of hidden layers\n ACTIVATION = \"tanh\"      # tanh | relu\n-BATCH_SIZE = 24          # rows per step\n+BATCH_SIZE = 20          # rows per step\n TRAIN_SEQ_LEN = 16       # positions per row (examples per step = BATCH_SIZE * TRAIN_SEQ_LEN)\n OPTIMIZER = \"adam\"       # adam | sgd\n LR = 0.003\n", "metrics": {"memory_gb": 0.1, "wall_s": 8.554, "samples": [2.776318710359747], "val_epoch": 0}, "meta": {"commit": "a14417d", "program_version": "67a030e", "keep_rule": "strict", "mode": "hardened", "verdict": "gain +0.0188 > 0.0", "verdict_details": {"gain": 0.018830008730828407}, "crash_reason": null, "summary": {"val_bpb": 2.776319, "training_seconds": 8.2, "total_seconds": 8.4, "peak_mem_mb": 79.5, "num_steps": 2146.0, "num_params_M": 0.05, "depth": 1.0}, "edit_kind": null, "edit": null, "hypothesis": "The previous BATCH_SIZE reduction (32\u219224) improved val_bpb by allowing more gradient updates in the fixed time budget. A further modest reduction (24\u219220, ~1.2x more steps) should continue this trend while avoiding gradient noise from extremely small batches.", "components": ["hyperparameters"], "fix_attempts": 0, "crash_kind": null, "budget_event": null}, "t": 1790334420.015792, "seq": 3}
{"id": "exp_e5a0890278", "parent": "exp_6b42401c09", "round": 4, "kind": "candidate", "status": "keep", "score": 2.7508922653056973, "cost": 0.1, "change": "Reduce BATCH_SIZE 20 -> 16 for more training steps", "artifact_id": "23fe99bee41168cee58d21a60fce50a91406c62dd70f39cdf4faf06e448ff9dd", "diff": "--- a/train.py\n+++ b/train.py\n@@ -26,7 +26,7 @@\n HIDDEN = 128             # width of each hidden layer\n DEPTH = 1                # number of hidden layers\n ACTIVATION = \"tanh\"      # tanh | relu\n-BATCH_SIZE = 20          # rows per step\n+BATCH_SIZE = 16          # rows per step\n TRAIN_SEQ_LEN = 16       # positions per row (examples per step = BATCH_SIZE * TRAIN_SEQ_LEN)\n OPTIMIZER = \"adam\"       # adam | sgd\n LR = 0.003\n", "metrics": {"memory_gb": 0.1, "wall_s": 8.592, "samples": [2.7508922653056973], "val_epoch": 0}, "meta": {"commit": "cf01a07", "program_version": "67a030e", "keep_rule": "strict", "mode": "hardened", "verdict": "gain +0.0254 > 0.0", "verdict_details": {"gain": 0.025426445054049562}, "crash_reason": null, "summary": {"val_bpb": 2.750892, "training_seconds": 8.2, "total_seconds": 8.5, "peak_mem_mb": 78.9, "num_steps": 2613.0, "num_params_M": 0.05, "depth": 1.0}, "edit_kind": null, "edit": null, "hypothesis": "Smaller batch size allows more gradient updates within the fixed 8-second budget. Previous batch size reductions have consistently improved val_bpb (32\u219224 gained 0.034, 24\u219220 gained 0.018), indicating this is the right direction. More frequent updates with noisier gradients should improve generalization on unseen data.", "components": ["hyperparameter", "training_loop"], "fix_attempts": 0, "crash_kind": null, "budget_event": null}, "t": 1790334514.9544544, "seq": 4}
{"id": "exp_1b0a110184", "parent": "exp_e5a0890278", "round": 5, "kind": "candidate", "status": "keep", "score": 2.7329621617331674, "cost": 0.1, "change": "Reduce BATCH_SIZE 16 -> 12 for more training steps", "artifact_id": "2aa645d4452e0c7362ea8a9f4fe0a6db909f1a6d2bcef13804bc21065bebc214", "diff": "--- a/train.py\n+++ b/train.py\n@@ -26,7 +26,7 @@\n HIDDEN = 128             # width of each hidden layer\n DEPTH = 1                # number of hidden layers\n ACTIVATION = \"tanh\"      # tanh | relu\n-BATCH_SIZE = 16          # rows per step\n+BATCH_SIZE = 12          # rows per step\n TRAIN_SEQ_LEN = 16       # positions per row (examples per step = BATCH_SIZE * TRAIN_SEQ_LEN)\n OPTIMIZER = \"adam\"       # adam | sgd\n LR = 0.003\n", "metrics": {"memory_gb": 0.1, "wall_s": 8.571, "samples": [2.7329621617331674], "val_epoch": 0}, "meta": {"commit": "82fcdc2", "program_version": "67a030e", "keep_rule": "strict", "mode": "hardened", "verdict": "gain +0.0179 > 0.0", "verdict_details": {"gain": 0.017930103572529887}, "crash_reason": null, "summary": {"val_bpb": 2.732962, "training_seconds": 8.2, "total_seconds": 8.5, "peak_mem_mb": 77.6, "num_steps": 3261.0, "num_params_M": 0.05, "depth": 1.0}, "edit_kind": null, "edit": null, "hypothesis": "Previous batch size reductions (32\u219224, 24\u219220, 20\u219216) have consistently improved val_bpb by enabling more weight updates within the fixed budget. Reducing BATCH_SIZE to 12 (25% reduction, matching the first step's reduction percentage) should allow ~25% more training steps, continuing this trend while keeping model capacity unchanged.", "components": ["hyperparameters", "training_loop"], "fix_attempts": 0, "crash_kind": null, "budget_event": null}, "t": 1790334617.328833, "seq": 5}
{"id": "exp_d84e264526", "parent": "exp_1b0a110184", "round": 6, "kind": "candidate", "status": "keep", "score": 2.7193235432340574, "cost": 0.1, "change": "Reduce BATCH_SIZE 12 -> 10 for more training steps", "artifact_id": "cba39df2f7533e9c1a02a045646398b92923594e2a18c197bf78b4cd4058de44", "diff": "--- a/train.py\n+++ b/train.py\n@@ -26,7 +26,7 @@\n HIDDEN = 128             # width of each hidden layer\n DEPTH = 1                # number of hidden layers\n ACTIVATION = \"tanh\"      # tanh | relu\n-BATCH_SIZE = 12          # rows per step\n+BATCH_SIZE = 10          # rows per step\n TRAIN_SEQ_LEN = 16       # positions per row (examples per step = BATCH_SIZE * TRAIN_SEQ_LEN)\n OPTIMIZER = \"adam\"       # adam | sgd\n LR = 0.003\n", "metrics": {"memory_gb": 0.1, "wall_s": 8.611, "samples": [2.7193235432340574], "val_epoch": 0}, "meta": {"commit": "151c532", "program_version": "67a030e", "keep_rule": "strict", "mode": "hardened", "verdict": "gain +0.0136 > 0.0", "verdict_details": {"gain": 0.013638618499109967}, "crash_reason": null, "summary": {"val_bpb": 2.719324, "training_seconds": 8.2, "total_seconds": 8.5, "peak_mem_mb": 78.2, "num_steps": 3782.0, "num_params_M": 0.05, "depth": 1.0}, "edit_kind": null, "edit": null, "hypothesis": "The trend of batch size reduction has consistently improved val_bpb (each reduction by 16-25% yielded 1-3% improvements). Within a fixed time budget, more frequent gradient updates with smaller batches appear to outperform fewer large-batch updates. BATCH_SIZE=10 (-17% reduction) should continue this trend.", "components": ["hyperparameters"], "fix_attempts": 0, "crash_kind": null, "budget_event": null}, "t": 1790334699.147368, "seq": 6}
{"id": "exp_8698f01e1e", "parent": "exp_d84e264526", "round": 7, "kind": "candidate", "status": "keep", "score": 2.7126748215076586, "cost": 0.1, "change": "Reduce BATCH_SIZE 10 -> 8 for more training steps", "artifact_id": "f924d2bf03a4c9048fdf69e9a0861816aa72a64e29f09f349869434280099834", "diff": "--- a/train.py\n+++ b/train.py\n@@ -26,7 +26,7 @@\n HIDDEN = 128             # width of each hidden layer\n DEPTH = 1                # number of hidden layers\n ACTIVATION = \"tanh\"      # tanh | relu\n-BATCH_SIZE = 10          # rows per step\n+BATCH_SIZE = 8           # rows per step\n TRAIN_SEQ_LEN = 16       # positions per row (examples per step = BATCH_SIZE * TRAIN_SEQ_LEN)\n OPTIMIZER = \"adam\"       # adam | sgd\n LR = 0.003\n", "metrics": {"memory_gb": 0.1, "wall_s": 8.642, "samples": [2.7126748215076586], "val_epoch": 0}, "meta": {"commit": "20f4498", "program_version": "67a030e", "keep_rule": "strict", "mode": "hardened", "verdict": "gain +0.0066 > 0.0", "verdict_details": {"gain": 0.006648721726398854}, "crash_reason": null, "summary": {"val_bpb": 2.712675, "training_seconds": 8.2, "total_seconds": 8.5, "peak_mem_mb": 76.8, "num_steps": 4250.0, "num_params_M": 0.05, "depth": 1.0}, "edit_kind": null, "edit": null, "hypothesis": "The consistent trend of improvement from reducing batch size (32\u219224\u219220\u219216\u219212\u219210) suggests that with a fixed training budget, more steps on smaller batches outweighs the gradient noise. Reducing from 10\u21928 should allow ~25% more steps (160\u2192128 examples/step), following the established pattern of diminishing but positive gains.", "components": ["hyperparameters", "training_loop"], "fix_attempts": 0, "crash_kind": null, "budget_event": null}, "t": 1790334797.0426338, "seq": 7}
{"id": "exp_cfb9f7f50e", "parent": "exp_8698f01e1e", "round": 8, "kind": "candidate", "status": "keep", "score": 2.70893629209648, "cost": 0.1, "change": "Reduce BATCH_SIZE 8 -> 6 for more training steps", "artifact_id": "4dacdf225684e08b25e5d0339cf0e70820c6d9b3e1c6d3ecde7f8aa04ab234d3", "diff": "--- a/train.py\n+++ b/train.py\n@@ -26,7 +26,7 @@\n HIDDEN = 128             # width of each hidden layer\n DEPTH = 1                # number of hidden layers\n ACTIVATION = \"tanh\"      # tanh | relu\n-BATCH_SIZE = 8           # rows per step\n+BATCH_SIZE = 6           # rows per step\n TRAIN_SEQ_LEN = 16       # positions per row (examples per step = BATCH_SIZE * TRAIN_SEQ_LEN)\n OPTIMIZER = \"adam\"       # adam | sgd\n LR = 0.003\n", "metrics": {"memory_gb": 0.1, "wall_s": 8.623, "samples": [2.70893629209648], "val_epoch": 0}, "meta": {"commit": "518082c", "program_version": "67a030e", "keep_rule": "strict", "mode": "hardened", "verdict": "gain +0.0037 > 0.0", "verdict_details": {"gain": 0.0037385294111786926}, "crash_reason": null, "summary": {"val_bpb": 2.708936, "training_seconds": 8.2, "total_seconds": 8.5, "peak_mem_mb": 77.5, "num_steps": 5209.0, "num_params_M": 0.05, "depth": 1.0}, "edit_kind": null, "edit": null, "hypothesis": "The pattern of batch size reduction (32\u219224\u219220\u219216\u219212\u219210\u21928) has consistently improved val_bpb despite diminishing returns. With a fixed budget, more frequent gradient updates should continue to help. Reducing to BATCH_SIZE=6 allows ~17% more training steps while keeping sequence length and model structure unchanged, following the proven approach.", "components": ["hyperparameter", "training_loop"], "fix_attempts": 0, "crash_kind": null, "budget_event": null}, "t": 1790334906.8868318, "seq": 8}
{"id": "exp_f0d5f03a72", "parent": "exp_cfb9f7f50e", "round": 9, "kind": "candidate", "status": "discard", "score": 2.7272621709809135, "cost": 0.1, "change": "Reduce BATCH_SIZE 6 -> 5 for more training steps", "artifact_id": "a762c7514cd9d76ae89dd04594625311f4d02ce3eafd7959a62d50ec385d0ced", "diff": "--- a/train.py\n+++ b/train.py\n@@ -26,7 +26,7 @@\n HIDDEN = 128             # width of each hidden layer\n DEPTH = 1                # number of hidden layers\n ACTIVATION = \"tanh\"      # tanh | relu\n-BATCH_SIZE = 6           # rows per step\n+BATCH_SIZE = 5           # rows per step\n TRAIN_SEQ_LEN = 16       # positions per row (examples per step = BATCH_SIZE * TRAIN_SEQ_LEN)\n OPTIMIZER = \"adam\"       # adam | sgd\n LR = 0.003\n", "metrics": {"memory_gb": 0.1, "wall_s": 8.66, "samples": [2.7272621709809135], "val_epoch": 0}, "meta": {"commit": "927a904", "program_version": "67a030e", "keep_rule": "strict", "mode": "hardened", "verdict": "gain -0.0183 <= 0.0", "verdict_details": {"gain": -0.0183258788844336}, "crash_reason": null, "summary": {"val_bpb": 2.727262, "training_seconds": 8.3, "total_seconds": 8.5, "peak_mem_mb": 77.4, "num_steps": 5358.0, "num_params_M": 0.05, "depth": 1.0}, "edit_kind": null, "edit": null, "hypothesis": "Continuing the consistent trend: smaller batches allow more weight updates within the fixed budget, and empirically this has yielded steady improvements (though gains are diminishing). Each reduction has improved val_bpb by trading gradient noise for optimization frequency.", "components": ["hyperparameters"], "fix_attempts": 0, "crash_kind": null, "budget_event": null}, "t": 1790335001.1901863, "seq": 9}
{"id": "exp_f6984572e6", "parent": "exp_cfb9f7f50e", "round": 10, "kind": "candidate", "status": "keep", "score": 2.6878274079011892, "cost": 0.1, "change": "Increase HIDDEN 128 -> 160 to better utilize the extra training steps from smaller batch size", "artifact_id": "7e4615426cf466d5a413233db3b5efca91fd5fdc68713381c0361eaa058d461e", "diff": "--- a/train.py\n+++ b/train.py\n@@ -23,7 +23,7 @@\n # ---------------------------------------------------------------------------\n CONTEXT = 6              # bytes of history the model sees\n EMBED_DIM = 16           # byte embedding size\n-HIDDEN = 128             # width of each hidden layer\n+HIDDEN = 160             # width of each hidden layer\n DEPTH = 1                # number of hidden layers\n ACTIVATION = \"tanh\"      # tanh | relu\n BATCH_SIZE = 6           # rows per step\n", "metrics": {"memory_gb": 0.1, "wall_s": 8.679, "samples": [2.6878274079011892], "val_epoch": 0}, "meta": {"commit": "6448d3e", "program_version": "67a030e", "keep_rule": "strict", "mode": "hardened", "verdict": "gain +0.0211 > 0.0", "verdict_details": {"gain": 0.021108884195290667}, "crash_reason": null, "summary": {"val_bpb": 2.687827, "training_seconds": 8.2, "total_seconds": 8.6, "peak_mem_mb": 85.1, "num_steps": 4495.0, "num_params_M": 0.061, "depth": 1.0}, "edit_kind": null, "edit": null, "hypothesis": "With BATCH_SIZE=6, we have ~7-10x more training steps than the baseline. The current HIDDEN=128 appears under-parameterized for this amount of training data. Increasing capacity to 160 units should let the model extract more signal from the additional gradient updates while staying well within memory constraints.", "components": ["model_architecture", "hyperparameters"], "fix_attempts": 0, "crash_kind": null, "budget_event": null}, "t": 1790335097.6036515, "seq": 10}
{"id": "exp_c6e6482276", "parent": null, "round": 0, "kind": "baseline", "status": "keep", "score": 2.829327388617751, "cost": 0.1, "change": "baseline", "artifact_id": "c3640d1810ba08961be266e3025f3f94b0bf06e7ee27a3ba2d400b7fff280d33", "diff": "", "metrics": {"memory_gb": 0.1, "wall_s": 8.461, "samples": [2.829327388617751], "val_epoch": 0}, "meta": {"commit": "906744c", "program_version": "67a030e", "keep_rule": "strict", "mode": "hardened", "verdict": null, "verdict_details": null, "crash_reason": null, "summary": {"val_bpb": 2.829327, "training_seconds": 8.1, "total_seconds": 8.4, "peak_mem_mb": 80.6, "num_steps": 1390.0, "num_params_M": 0.05, "depth": 1.0}, "audit": {"test_iid": 2.8936357541786193, "test_shift": 2.96233469768545, "loop_metric_rerun": 2.8362706463732787}}, "t": 1790334036.8973985, "seq": 0}
{"id": "exp_2ce1f2e640", "parent": "exp_c6e6482276", "round": 2, "kind": "candidate", "status": "keep", "score": 2.7951487190905753, "cost": 0.1, "change": "Reduce BATCH_SIZE 32 -> 24", "artifact_id": "0094b1cca9fe55e16cec9fe8d0f0588b9279d9dbdee2fbfbb0cba32e16b48310", "diff": "--- a/train.py\n+++ b/train.py\n@@ -26,7 +26,7 @@\n HIDDEN = 128             # width of each hidden layer\n DEPTH = 1                # number of hidden layers\n ACTIVATION = \"tanh\"      # tanh | relu\n-BATCH_SIZE = 32          # rows per step\n+BATCH_SIZE = 24          # rows per step\n TRAIN_SEQ_LEN = 16       # positions per row (examples per step = BATCH_SIZE * TRAIN_SEQ_LEN)\n OPTIMIZER = \"adam\"       # adam | sgd\n LR = 0.003\n", "metrics": {"memory_gb": 0.1, "wall_s": 8.539, "samples": [2.7951487190905753], "val_epoch": 0}, "meta": {"commit": "568c10b", "program_version": "67a030e", "keep_rule": "strict", "mode": "hardened", "verdict": "gain +0.0342 > 0.0", "verdict_details": {"gain": 0.03417866952717574}, "crash_reason": null, "summary": {"val_bpb": 2.795149, "training_seconds": 8.1, "total_seconds": 8.4, "peak_mem_mb": 80.3, "num_steps": 1822.0, "num_params_M": 0.05, "depth": 1.0}, "edit_kind": null, "edit": null, "hypothesis": "With a fixed wall-clock time budget, smaller batch size enables ~33% more gradient update steps. This allows more thorough training convergence within the same 8-second budget, offsetting slightly noisier per-step gradients.", "components": ["optimizer", "hyperparameters"], "fix_attempts": 0, "crash_kind": null, "budget_event": null, "audit": {"test_iid": 2.8547781469110283, "test_shift": 2.916574646487384, "loop_metric_rerun": 2.801355847720059}}, "t": 1790334314.0467677, "seq": 2}
